image_path,sentence,label
224.png,"47 % 1:17 PM AT & T E /r forward Strom O C forwardsfromgrandma lmgur . Com Trump Train Sep 13 at 9:02am One day , Hitler referenced the Jews as deplorable and irredeemable . The crowd agreed The next day , Auschwitz was born . Hillary Clinton called millions of conservatives a basket of deplorables , irredeemables . The crowd agrees Whats next a concentration camp for conservatives . ",1
225.png,`` Trumpets '' `` Trump Pence '' `` Trumpets ! '' ,0
226.png,"`` The Winne reppan , Bernie Sand ‰ÛÏThe winner is actually Bernie Sanders ... '' 66 RAL DORAL ! DEMOCRAT ",0
227.png,Bernie or Hillary ? Be infonned . Compare them on the issues that matter . Issue : Selling Weed ,0
228.png,"I AM NOT AN FERVENT HILLARY CLINTON SUPPORTER BUT BERNIE SANDERS SHOULD DROP OUT OF THE RACE , HE IS N'T GOING TO BE THE NEXT PRESIDENT on inngur ",0
229.png,"non debateable Inbox x May 28 ( 2 days ago r to me HI/u/ezzeloharr , i sent your email to aunties Sewermouth TRUMP , has brought out all the dormant evils un the U.S. , , racism , bigotry , supremacy wierdos , liberterians , and blame on other people who might not agree IT 's comparable to the crumbling ROMAN EMPIRE . pray sanity will prevail but it ' not looking good.VIVE CANADA//lovell grandpapa// ",0
230.png,MONESSEI UNDU MAN UNPs are do he SCOTT BEVERIDGE/OBSERVER-REPORTER John Bogacik of Elizabeth stood among Donald Trump sup- porters Tuesday when the presidential candidate spoke at a private gathering in Monessen . ,0
231.png,This is donald trumps brother donut trump . Every 4.20 seconds donald takes a of his brothers donuts . updough this post in 375 degrees boiling oil and comment `` dont be a grump mr trump '' to help donut ,1
232.png,MAKE AMERICA GREAT AGAIN HILLARY ,1
233.png,"I do n't believe that women have any rights , and think gays should be hanged . No , actually , I'ma Muslim and those are my religious beliefs . Wow , what a complete primitive asshole you are ! You must bea Republican . Oh ! I 'm sorry ! apologize ! Ihope you do n't think I 'm Islamophobic ! ( c ) 2016 Dixon Diaz ",1
234.png,"The fuck Bernie Sanders ' starter pack THE SCIENCE OF ECONOMICS THE ECONOMIC TEACHING OF LEON MACLAREN discover the conditons which allow evey indwodual true goal of Economics Patriot Wikipedia , the free encyclopedia https : //en.m.wikipedia.org wiki Patriot Mobile-friendly A patriot is someone who feels a strong support for their country , See also Patriotism RAYMOND MAKE WELL Ed Patriotism New England Patriots ",1
235.png,"July 14 at 10:03 AM Here 's a social experiment for ya , go to the Donald J . Trump Facebook page and see how many of your friends have `` liked '' his page . Then go to Hillary Clinton 's Facebook page and see how many of your friends have liked her page and post the results below . Chances are if she wins it 'll be because of voter fraud . Hillary 4 Trump 185 Like Share Comment 4.7K ",1
236.png,# Feel The Bern ,0
237.png,"As a Virginia m embarrassed that Trump won my state , even if it 's just the Republican Primary . We have the fourth best public school system in the country and we 're blowing it . Like Comment Share and 5 others Theres a fairly good chance some bernie supporter will shoot him if he gets elected . The secret service does n't exactly have the greatest track record Like Reply 30 mins Edited Write a comment ... ",0
238.png,what if bernie sanders was an apache helicopter ? ProjectMurphv ,0
239.png,THE DEMOCRAT PARTY HAS STARTED THEIR REGISTRATIONIDRIVE ,1
240.png,BRACE YOURSELVES FORMIKE PENCE MEMES How big is my ego ? This big ! ,1
241.png,REMEMBER WHEN EVERYONE WAS FOR BERNIE AND NEVERWANTED HILLARY TO BE PRESIDENT PEPPERIDGE FARMREMEMBERS ,0
242.png,"While some might see nothing but a piece of cardboard , Ernie wallows in the horrifying truth that years of innefective chemotherapy has left Bert so frail and weak that he is indistinguishable from thick card stock . Knowing Bert is no longer capable of coherent communication , Bernie wonders if his brother resents him for his miserable state , trapped here , infirm and unable to interact with the world . Not for the first time Bernie , seeing Bert struggle simply to move his eyes and to breathe , doubts he made the right choice . ",0
243.png,"Bernie or Hillary ? Be informed . Compare them on the issues that matter Issue : Selena The loss of Selena was unsurmountable I loved J . Lo She would 've been the superstar of this lifetime as she crossed over from the Spanish-language market to mainstream in that movie ! English markets . Her fashion sense , stage presence , dance moves and charisma were like none I 'd seen before . Fuck Yolanda Saldivar . ",0
244.png,"Dad , do we Feel The Bern ? No son . We have responsibilities and contribute to society ",0
245.png,"Hillary Clinton Folgen @ HillaryClinton made . Delete your account . Donald J. Trump @ realDonald Trump Obama just endorsed Crooked Hillary He wants four more years of Obama-but nobody else does ! 6 Ubersetzung anzeigen RETWEETS GEFALLT 5.527 5.363 08:27 9 . Juni 2016 t 5,5 Tisd . 5,4 Tsd . ",1
246.png,"MAGAZINE SEARCH EMAIL SIGNUP poumoo.coM 8 f OUR LATEST I 'M WITH ECER Add my name 2016 Think You 've Got It Locked , Hillary ? Meet Jill Stein . The Green Party candidate insists it 's her year to get noticed and she may make it onto 47 state ballots . By BILL SCHER I June 19 , 2016 Getty Images ",0
247.png,"Native American Bernie Sanders Supporters are n't calling themselves `` Indian Berns , '' they re doing It wrong . TJ Wharry @ twharry ",1
248.png,9:21 PM ooo AT & T K Messages Bernie Sanders Details U watchin debate ? Yes Whatcha think ? Yes What is she doingggggg 222 Right ? O Text Message Send Q W E R T Y U I O P A S D F G H J K L 123 return space ,0
249.png,TRUMP PENCE VP DEBATE 1108 18 RS MIN SEC LIVE ON CNN TONIGHT 2016 RACE LIVE ENCE vs. KAINE IN vp DEBATE AT 9pM ET ON cNN CNN NAS 21.2 S ARE ON THE ROLLS THAN REPUBLICANS NUMBER IS A KEY METRIC C NEWSROOM ,0
250.png,NOT SURE IF TRUMP 'S PART OF A CONSPIRACY TO ELECT HILLARY OR HILLARY PART OF A CONSPIRACY TO FLECT TRUMP ,1
251.png,"Ya Bol Bernie Apr 30 at 6:48pm B oh noe ! if you come upon this image while scrolling you have been visited by DAT BOl BERNIE ! Comment `` o shit waddup '' in 42069 seconds and you will be blessed with student loan forgiveness , or else you will be doomed to suffer at the hands of the yuge corporashuns and smoke only mids forever o shi wadd ",1
252.png,"Cincinnaj Cincinnati CINCINNATI Cinci Lincinnati incinn State Cinci Cincinnati Cinci State ti BALLOT BOWL 08 ate CNN SEN , HILLARY CLINTON 11:04a PT ncin ( D ) PRESIDENTIAL CANDIDATE AYS ITS NUCLEAR PROGRAM IS FOR ENERGY , NOT WEAPONS ",1
253.png,IF YOU SEE THIS IMAGE WHILE SCROLLING THE FIRST PAGE You have been visited by The Unstumped bird of TRUMP President Trump will come to youn 2016 but only if you reply `` Ca n't Stump The Trump '' in this thread ,1
254.png,Had an Ethics class where people were shitting on Trump . destroyed most of their arguments . Prof asked me to stay after class . He thanked me and told me he was afraid to be pro Trump in that class . ,0
255.png,"please dont watch/try to converse w/ me if you are/believe in any of the following : anti-sjw anti feminism anti self-diagnosis homophobic/transphobic/etc believe in any form of reverse oppression tru scum/transmedicalist anti other kin/fictionkin or disagree with nounself/neopronouns ( im not otherkin myself but i have friends who are are and i will fight anyone who harasses them > :0 ) ship anything incestous , pedophilic , a large age gap , or abusive agree with donald trump/want him for president ( ya need bernie sanders ) ",0
256.png,"3 WIVES , 4 BANKRUPTCIES , 5 TIME ORAFT DODGER CREATES FAKE UNIVERSITLOUTSOURCES JOBS TO MEXICO AND CHINA HIRES 200 UNDOcUMENTED POLISH WORKERS , RIPS THEM OFF WANTS TOUSECOURUSTOSILENCE MEDIA . THINKS TED CRUTS FATHER KILLED JFK IS THE REPUBLICAN PRESUMPTIVE CANDIDATE ",1
257.png,TRUMP 'S FACE LOOKS LIKE A TRAGIC ACCIDENT THE ANUS BLEACHING SALON made on imgur ,0
258.png,Ummm I think that somehow your computer is autocrrecting Cruz '' like Santa Cruz to `` lil baby pee pee hahahaha yeah ! I have the evidence to show you later and Paul Bonerstink What why ? OMG I NOTICED THAT TODAY TOO WHYYYYY it 's a plug-in that changes the names of Republican Presidential candidates to dirty words hahahahaha Oh my god Seriously ,1
259.png,"Harold M . for STATE District 6 Endorsed Democrat l Vote November Ath Democratic V A Balanced Approach to State Policy Making I will continue to support education funding to produce an educated workforce with the skills to to Island . I will to it is important for the least of society , as ect the to maintain the social safety network des advocating ( seniors and ised for re-entry programs for prison . orted trong ",0
260.png,Yoko Ono attempts to devour Donald Trump 's tiny soul . ,1
261.png,"Ivp debatel MODERATOR : ur running mate supported the iraq war PENCE : Well trump ziplines in WRONG MODERATOR : mr trump ucannot be here 10/4/16 , 5:18 PM 147 RETWEETS 364 LIKES ",1
262.png,Oh no ! Bernie has been G captured b Hillary ISIS Clinton ! Submit your Karma reserves now to Save Bernie from certain death ! ! ,1
263.png,IFWOUGREWTIREDOFTHE FEEL THE BERN POSTSCLOGGING UPTHEREDDITFRONTPAGETHISPASTYEAR.HAVENO FEAR OVER THENETFOURMONTHSREDDITIS GOING TO FEELTHEJOHNSONRIGUARANTEE IT . Com ,0
264.png,HILLARY CLINTON 'S POLICIES FOR BLACK AMERICANS HOME SUMMEDUPIN ONE PICTURE ,1
265.png,"I do n't believe that women have any rights , andlthink gays should be hanged . No , actually , l 'm a Muslim and those are my religious beliefs . Wow , what a complete 4 primitive asshole you are ! You must be a Republican . Oh I 'm sorry ! apologize ! I hope you do n't think I 'm Islamophobic ! ( c ) 2016 Dixon Diaz ",1
266.png,Donald J. Trump @ real Donald Trump . Th v I will post a nude of myself if anyone can pass level 4 on my new game `` Trump On The Run # DownloadNow 22.5K 42K ,1
267.png,"Ya Boi Bernie Apr 30 at 6:48pm oh noe ! if you come upon this image while scrolling you have been visited by DAT BOl BERNIE ! Comment `` o shit waddup '' in 42069 seconds and you will be blessed with student loan forgiveness , or else you will be doomed to suffer at the hands of the yuge corporashuns and smoke only mids forever o shi Waddu DAT BOI ROLLIN THROUGH THE PRIMARIES d d d ",1
268.png,dded a post from July 18 to his timeline 2 hrs Quote of the day from a random FB comment . This was in response to Trumps comments about McCains service . `` Donald Trump is the poop stain on Americas underwear . '' 3 Likes I Like Comment Share ,1
269.png,ooo T-Mobile LTE 6:22 PM 46 % a Hillary Clinton Home Posts Photos Videos Events Abc anything you want even president . Tonight is for you . 413 Comments 2K Shares 17.3K Like Comment Share Marketplace Notifications News Feed More ,0
270.png,IF YOU SEE THIS IMAGE WHILE SCROLLING YOU HAVE BEEN VISITED BY THE GARY JOHNSON OF LIBERTY blessed entrepreneurship and legal weed will come to you but only if you comment `` do n't tread on me '' ,1
271.png,"`` WE DO N'T HAVE A COP PROBLEM IN AMERICA . ARE THERE PROBLEM COPS ? SURE , BUT BLACK AMERICA DOES NOT HAVE A COP PROBLEM . THE COPS DO MORE IN OUR NEIGHBORHOOD THAN THEY DO IN ANY OTHER NEIGHBORHOOD WE HAVE A LIBERAL DEMOCRAT PROBLEM KEVIN JACKSON ",1
272.png,LIBNUTZ Dixon Diaz Hillary 's leaked emails prove she sold weapons to ISIS And told Wall Street bankers that Who cares ? Trump said her public positions are different pussy from her private ones . Dixon Diaz 10/19/2016 ,0
273.png,"Add Friend 5 hrs I hopped in a cab today and my elderly cab driver was writing on his clipboard while driving ( literally accelerating and jotting ) , blaring Howie Carr , yelling ( like yelling , not just raising his voice in excitement , and with no provocation , I just said hello and something about the crazy weather about how Donald Trump is going to save the world , and then was pushy when I asked if they did a college discount with ID , saying `` you must be some sort of Bernie supporter socialist n the same breath he asked me how much I wanted to give him for tip so he could make the correct change . gave him an appropriate tip , because l understand cab drivers without tips ca n't actually live on the wage they 'd earn , and I 'm a fellow human bring who cares about others qaulity of life and fair pay for thier labor . But my head is still tilted and making a whattheactualfudge '' face . 1 Comment Like Comment a Share ",0
274.png,E Data to Be mtered Bernie ,0
275.png,"Wow ! Cold It was so cold this morning , I actually saw a Democrat with his hands in his own pockets . ",0
276.png,"Back April 25 , 2016 , 2:15 PM Guy at bus stop : Hey sexy Girl : ignores him ] Guy : said hey you fucking bitch Girl : Please leave me alone Guy : I 'll kill you god dammit l 'll do it Me : leave her alone buster Guy : What are u gon na do tough guy Me : takes trump hat off guy 's head and puts Bernie hat on his headl That 's what Guy : Hey what the Me : you 've been bernied bub Girl : Here 's my number call me [ everyone claps and cheers ] ",0
277.png,800 PM ET BREAKING NEWS CLINTON-TRUMP DEBATE BEGINS MOMENTARILY ON CNN LIVE ON CNN ,0
278.png,YOU SHOULD NEVER STEREOTYPE ANYONE NO MATTER WHAT GROUP THEY ARE A PART OF OH YOU ARE A REPUBLICAN YOU MUST BE RACIST THEN ,1
279.png,"CBS NEWS DEBATE `` Thank you , good night and may the Force be with you . '' HILLARY CLINTON ‹Ä_‹Ä_‹Ä_‹Ä_ ",0
280.png,The I just got into politics a few months ago and did n't pay attention to economics and history in high school starter pack 2016 Bernin ERNIE SANDERS COM 2016 r FEEL THE BERN ,0
281.png,SAMSUNG ‹Ä_ TRUMP ,1
282.png,oz PENCE ,0
283.png,THINGSITRUST MORE THAN DONALD TRUMP @ NFL MEMES 1 . FLINT MICHIGAN TAP WATER 2 . BILL cosBY DRINKS 3 ELEVATOR RIDES WITH RAY RICE ,0
284.png,"ITE 41 % 12:29 PM AT & T Bernie Sanders is my HERO 11 hrs Today , I had a front row seat to the Bernie Sanders rally in Washington DC . After the speech he shook the hands of supporters in the crowd . He approached me , I tapped his shoulder and told him `` do n't quit . '' His eyes began to water as he hugged me , thanked me , and promised to stay in the race . AFUTURE TO BELIEVE IN ",0
285.png,"DISTRESS like us on facebook `` I HAVE VOWED , I WILL NEVER VOTE FOR A DEMOCRAT AGAIN . NO MATTER WHO THEY ARE . I DO N'T CARE IF GOD BECOMES A DEMOCRAT THESE DEMOCRATS ARE COMMUNISTS THIS IS GANGSTERISM . THIS IS CRAZY ",1
286.png,le me in school e MA C bernie Sanders is dumb trump FF s li eld Ju FFE FF UU ,1
287.png,DONALD TRUMP . THE IDIOT made on ,1
288.png,"SAY , DARLIN WHAT ARE YOU GOING TO DO ABOUT JILL STEIN MAKING AN INDEPENDENT RUN FOR THE WHITE HOUSE ? HUSH , BILL M THINKING SMEAR JOB OR A HIT JOB ? WHICH WOULD HAVE THE BEST EFFECT ? ",0
289.png,"6 hrs An atheist , satanist , christian , jew , muslim , democrat , republican , libertarian , homosexual , and heterosexual walk into a bar . They have drinks , talk , and become friends . It 's what happens when you 're not being a douchebag to others 13 1 Comment Like Comment Share ",0
290.png,"82 % 1:54 PM Posts 4 hrs So last night my house house was robbed . To make it all the worse the victims were my children and their First Amendment rights . They had begged me to put a Trump sign out front of our house , which l was reluctant to do because of reasons such as this . The sign was stolen . It 's sad to see our country come to such a state . # ThoushaltNotSteal # MakeAmericaGreatAgain # Trump2016 TRUMP MAKEAMERICA GREAT AGAIN ! Like Share Comment CO Write a comment ",0
291.png,BERNIE SANDERSISOUT MOVE ALLYOURKARMATO TORNADOES ,0
292.png,"what the media wont post because its a positive outlook . Trump can actually be a good man . a DEMOCRAT said `` He was n't there to get votes he shook my hand and it felt real , he does care . '' Keep this in mind when voting . He might not show it a lot , but Trump does have a soft side Louisiana flood victims praise Donald Trump for visiting damaged areas Terry Phinney was not always a fan of Donald Trump 's , but when the Republican presidential candidate arrived at his Baptist church to meet flood victims Friday , ... LATIMES COM BY LOS ANGELES TIME ",0
293.png,ALL THE REAL RACIST VOTE DEMOCRAT ,1
294.png,"Hey Bernie What 's the difference between Progressivism , Fascism , Liberalism Marxism Communism Socialism . Nazism and the Democrat party ? MU SPELLING ! ",0
295.png,Bernie or Hillary ? Be informed . Compare them on the issues that matter . Issue : Favorite DLR Conner Tanner ,0
296.png,"As a 27 year old staff attorney for the House Judiciary Committee during the Watergate investigation , Hillary Rodham was fired by her supervisor , lifelong Democrat Jerry Zeifman . Hillary a da When asked why Hillary Rodham was fired , Zeifman said in an interview , `` Because she was a liar . She was an unethical , dishonest lawyer , she conspired to violate the Constitution , the rules of the House , the rules of the Committee , and the rules of confidentiality . '' ",0
297.png,HERE COME JOHNSON 2016 FACEBOOK REASONABLE PEOPLE FOR GARY JOHNSON ,0
298.png,"t 's funny that `` democrats '' get mad at eh `` lefties '' for supporting Bernie . But the Dem party is the party of FDR . The leftist party . All you centrist fuckers should switch to republican if you do n't want to keep progressing left . Or you old ones can hurry and die , and the young dumb ones ... Wel heard bleach tastes really good . Like Reply 9 1 hr ",0
299.png,STILL ABETTERTEAMOWNER EL MEMES THAN DONALD STERLING ,0
300.png,"ELECTORAL MAP CLINTON WNS 272 VOTES THE ROAD TO 270 272 EURETION NIGH CLINTON 179 ON CNN BREAKING NEWS LIVE WENER SENTING PROBE LEADS FBI TO REVIEW CLINTON CNN CASE FROM THE US . MILITARY , 9:33 PM E CHINA 'S MILITARY SPOKESPERSON SAYS AM AC360 ",1
301.png,"`` I'MUNDOUBTEDLY A LIBERAL , WHICH MEANS THAT I MIN ALMOST TOTAL AGREEMENT WITH THE EISENHOWER-ERA REPUBLICAN PARTY PLATFORM . '' RACHEL MADDOW AMERICANS AGAINST THE REPUBLICAN PARTY bit.ly stopthegop ",1
302.png,WE LIKE IKE I LIKE IKE FRANK CULOTTA REPUBLICAN CLUB IN IKE/ IS FOR US WE LIKE IKE/ K ,1
303.png,SUCCESSFUL REPUBLICAN GOVERNOR FOR8 INDEPENDENT POLITICIAN FOR ALMOST 40 YEARS YEARS Gary Johnson 2016 BECOMES A STANDS BY WHAT HE DEMOCRAT TO RUN BELIEVES IN AND RUNS FOR FOR PRESIDENT PRESIDENT AS A LIBERTARIAN ,1
304.png,"22 hrs America does not need a conservative or liberal , AMERICA does not need a republican or Democrat President or Congress , America needs our leadership to get on his or her knees and dedicate America back to God just like our forefathers did years ago ! Wake up America and turn back to the roots of this ONCE great country that once sang of God as it 's sovereign Lord . Like Comment Share 12 people like this . ",1
305.png,Bernie or Hillary ? Be informed . Compare them on the issues that matter Issue : Soccer Emirate obvious plant ,0
306.png,"here come dat boi ! ! ! ! ! ! o shit waddup ! thought it was take . Sorry for doubting you , Bernie Sanders . ",0
307.png,"To All of the Dumbass Liberals Who Promise '' They 'll Move to another Country , if Trump Wins ... I Say This If Hillary Wins I 'm NOT Moving Anywhere I 'm Buying More Ammo And Taking Back My Country YouMay Want to Movel ",1
308.png,"I do n't believe that women have any rights , and I think gays should be hanged . No , actually , I 'm a Muslim and those are my religious beliefs . Wow , what a complete 4 primitive asshole you are ! You must be a Republican . Oh ! I 'm sorry ! A I apologize ! I hope you do n't think I 'm Islamophobic ! ( c ) 2016 Dixon Diaz ",1
309.png,"In Libya Clinton pushed for a war that killed 30,000 people . The rebels ' Killery backed turned out to be Al Qaeda types . When Gaddafy was knife raped in the street , she said , `` We came , we saw , he died , '' and laughed . BERN ? FELT NOW THE ",0
310.png,IF DIE IN OFFICE SCREW MY VP . WEEKEND AT BERNIE 'S FOR THE REST OF MY TERM made on imgur ,0
311.png,BREAKING NEWS TRUMP AGAIN CALLS OBAMA ISIS FOUNDER ( HE 'S NOT Scottie Nell Hughes Trump Supporter 508 I ST SAYS HER PLANS WOULD CAEATE 10 MILLION JOBS CLINTON SAYS AC36 ,0
312.png,"T Yesterday at 3:07pm Most Republican candidates agree that they would indeed kill baby Hitler , given the chance . A far more interesting question , in my opinion , would be whether or not they 'd support aborting fetal Hitler MUA HA HA ! ",1
313.png,"SubjectPolitics Jun 17 at 5:34pm Obama spent his ENTIRE presidency going on comedy shows , now he has the NERVE to say say Donald J. Trump is n't serious . Obama has the NERVE to say Trump is n't `` serious '' SubjectPolitics.com After he spent his entire PRESIDENCY going on comedy shows 385,411 views 13 Comments ",0
314.png,"FACES OF THE POT 90 A Susan Saran dun and Tim Robbins were the darlings of Hollywood . Both had successful acting careers and supported Bernie `` The Mad Commie '' Sanders . After a rally in North Dakota to support oil hating Indians , they up their THE POT slammed two `` Burlington Bindles '' of SLAMMER ! veins . Now there dead like every other POT ",1
315.png,Feel The Bern ,0
316.png,"FINALLY FEELIN THE BERN I LOVE HOW ALL THE BERN- OUTS ARE LIKE , IT S JUST THE TIP ! JUST THE TIPI MENDORSE DOESNT MEAN DROPPING OUT ! '' HE DID NOT HAVE CAMPAIGN RELATIONS WITH THAT WOMAN made on imgur ",0
317.png,"matt the rapper Following The Matt Klein24 I felt the bern , but Hillary brought the aloe . # ImWithHer RETWEETS LIKES 9:44 PM-7 Jun 2016 ",0
318.png,"In addition to lambasting the zoo for the death of the gorilla , campaigners also want to make the deceased primate the president of America . Polling this month revealed two per cent of Texan voters supported the animal the same level of support as for Green Party candidate Jill Stein . ",0
319.png,OCTOBER 1980 POLLS REAGAN 39 % CARTER 45 % re NOVEMBER 1980 REAGAN WON INALANDSLIDE ! DONET BELIEVE THE POLLS ! GO OUT ANDVOTE TRUMP ! ,0
320.png,"Rebecca Cohen Follow GynoStar `` Hillary hate is rooted in sexism '' `` I 'm not sexist ! support Jill Stein , a woman who does n't have & never will have any power or influence '' RETWEETS LIKES 69 242 3:30 AM 18 Sep 2016 ",0
321.png,"SANDERSFORPRESIDENT Comments other discussions ( 4 ) view images ( 2 M By Endorsing Hillary Clinton , Bernie Sanders May Have Positioned Himself to Win The Presidency medium com submitted 4 hours ago MusicMagi O 24 comments source share save hide give gold report hide all child comments all 24 comments subscribe ",0
322.png,"17 hrs Clinton Kaine 2016 : Suck it up , America . Like Comment Share ",0
323.png,FEEL TH EL BERN ,1
324.png,"was tagged in a photo . MOM ! with SON 2 hrs `` Hey , where d you get that sticker ? '' `` I was at a football game and someone 's mom was putting them on everybody . `` Hey , did your school paper endorse Hillary ? '' `` Oh yeah . We did n't even say why . Totally obvious . We just went on to talk about voting and stuff . '' Like Comment Share ",0
325.png,"ey Girl , lem me holla at u about Bernie ",0
326.png,"heh mainstream culture frowns on bernie sanders so this hat might ostracize me but i stand up for what i believe in im a dangerous freedom fighter heh Bemie I 'll never fall sway to the status quo I 'm a rational thinker , not an emotional sheep . GOD FUCKING Knit DAMN IT FUCKING PIECE OF SHIT FUCKING IDIOT FASCIST ",1
327.png,"APRIL 25th 2016 Hillary Clinton supporters posted child pomography to numerous Bernie Sanders Facebook pages , then reported the pages to Facebook Will Sanders supporters do the same thing to retaliate ? Never in a million years It 's child pomography . We would never post it , or vote for someone who would condone that or do anything to win . That 's the difference between us . at 's what we are fighting for . SANDERS ",1
328.png,"Nathan Zed & @ Nathan ed CLINTON-TRUMP DEBATE BEGINS MONENTARL 7:06 PM 26 Sep 2016 7,397 RETWEETS 9.735 LIKES ",0
329.png,"Of the 33,000 emails Hillary Clinton deleted , over 2,000 of them contained Papa John 's promo codes , including one for a free order of Tuscan 6-cheese breadsticks with the purchase of any large 1-topping pizza . Thumbs up if you think Hillary should release the promo codes . CAFE ",1
330.png,"THE DIFFERENCES BETWEEN A REPUBLICAN AND A DEMOCRAT Donald Trump and Hillary Clinton were walking down the street when they came to a homeless person Donald Trump gave the homeless person his business card and told him to come to his office for a job . He then took $ 20 out of his pocket and gave it to the homeless person Hillary saw this , so when they came to another homeless person , she walked over to the home- less person and gave him directions to the welfare office She then reached into Donald 's pocket and got out $ 20 . She kept $ 15 . for `` administrative fees '' and gave the homeless person $ 5 Now do you understand the difference ? ",0
331.png,"Donald Trump has been in the public eye forover30years And , he 's NEVER been accused of being a racist until he startedrunningfor president and his political opponents started attacking him THINK ABOUT IT ! ! ",0
332.png,"Sammy Hagar is 68 years old . Bill Clinton is 69 . Sammy has had over 40 years of sex , alcohol , rock & roll , and drugs . Bill lives with Hillary . AN ",1
333.png,TRUMP WIANTISTO BE PRESIDENT BUT DOESNTPAY HIS FUCKING TAXES BUTIM CANADIAN SO ITS REALLY NONE OF MY BUSINESS ,0
334.png,"LOUDER WITH CROWDER COM A registered Democrat , Islamic terrorist mass-murders gay people . The Left blames Christians and the NRA . You ca n't write this stuff -STEVEN CROWDER SELIKE '' IF YOU AGREE ",0
