image_path,sentence,label
444.png,"Q10 If the candidates for President were Democrat Hillary Clinton , Republican Donald Trump , and independent Harambe , who would you vote for ? 48 % Hillary Clinton 43 % Donald Trump 5 % Harambe 4 % Not sure ... . ",0
445.png,SAYS GENDER AND RACEDONTMATTER VOTES FOR HILLARY BECAUSE ITS TIME FORA WOMAN PRESIDENT AND THINKSCULTURAL APPROPRIATION IS WRONG ,0
446.png,E Anonymous ( ID : pKvmKDaY ( Sun ) 20:04:07 No.78832917 06/26/16 BE HONEST WHAT WOULD YOU DOP trump tower png 945 KB PNG Well ? Anonymous ( ID HtrXYnkW I i 06/26/16 ( Sun ) 20:04:36 No.78832980 I 'd tell him he 's about to make Liveleak great again ,1
447.png,I SIGN UP ON REPUBLICAN EMAIL LISTS ASO I CAN MARK THEM AS SPAM made on imgur ,0
448.png,thewrap.com SUICIDE `` Suicide Squad ' Executive Producer Is Trump 's Chief Fundraiser Steven Mnuchin is involved in two intense missions this summer : Raising cash for Donald Trump and `` Suicide Squad '' mole show why cant 2016 be normal landmaster normal is a setting on a dryer ,1
449.png,ANGRY BERNIE SANDERS BE LIKE ,0
450.png,"Sorry , not when it 's a government spy tool and a distraction to the `` greater '' public from everything the government is trying to hide . I 'd prefer to know about events that Could possibly destroy our World Like the US sent troops to Putin Or Bernie teamed up with Clinton Or what 's happening in lsrael and their leaders dictatorship Oops ... too political for most minds . ",0
451.png,When people ask if you 're a democrat or a republican ,0
452.png,CNN CNN CN CNN CN NN CNN CAN Tunintelligible yellin CNN REPUBLICAN PRESIDENTIAL DEBATE LIVE CNN 9:09 PM ET ,1
453.png,New hobby : Putting Donald Trump 's mouth on puffer fish ,1
454.png,IF GARY JOHNSON COULD JUST -GET SOME MORE EXPOSURE THAT WOULD BE GREAT made on imgur ,0
455.png,UNSCATHED PENCE ,0
456.png,"After Cookie Monster loudly declares he is `` Feeling the Bern ' , Ernie re-christens him `` The Cuck-y Monster '' ",0
457.png,O 80 % 6:52 PM Replies No Obama is a terrorist muslim sympathizer that is democrat socialism 8 hours ago Like Reply Ithink Jennifer just strung together words she 's afraid of 7 hours ago Like I 1 Reply do n't think there 's a better explanation of that sentence . Just now Like Reply Write a reply ,1
458.png,O 4G 28 % 7:51 Top Tweet from your timeline HEINHE CIMBED LEERS 0:07 I CNN CNN 12h Is Gary Johnson the answer for voters looking for an alternative ? # LibTownHall airs at 9p ET Cnn.it/ 397 View Tweet 466 ,0
459.png,"Anonymous ( ID : ZH9bedF 5 hours ago No.75211812 > > 75211983 75212094 75212522 75213781 J ) 75214462 75214877 75216815 75218241 75218666 75219541 75219654 > > 75221452 75221775 75221786 75222880 75222895 Bernie does n't debate . He has a staring contest with the floor , takes as good and rough a fuck as the other candidate can give , clumsily whines about a few things , and then he walks off stage and posts something irrelevant on twitter like you should n't have to ask for ketchup packets at McDonnalds All Trump has to do is not break Bernie in half like Bane in Knightfall . He just softballs with his and goes in with kiddie gloves . Just enough to put on a show and blow out the commie , but not hard enough to alienate Bernies rabid fanbase . It shows Trump is doing more for women ( thanks to the charity donation ) than Trump ever did , while further dividing the Democratic party Gust take to social media to see the m spurging out ) and will net a decent chunk of Bernouts come November after they get a chance to actually see him speak . It also gives Trump some much needed experience in a 1v1 debate . Sanders is Glass Joe . He 's a tutorial . ",0
460.png,"[ score hidden ] 55 minutes ago Stop it . I 've been a member of the Green Party since 1994 , and I have never wasted my vote by voting Green for president . There 's just too much at stake to let the GOP in the White House . permalink save report give gold replied 1 point just now That 's funny considering just 10 day ago you stated the following : `` I am a hardline democrat . But ifIwere forced to choose between Trump and Cruz , i d choose Cruz . Because his politics are consistent and the Democrats in Congress would know how to fight against such a foe . I have no idea how to stonewall or compromise with Trump . Also as much as I dislike Cruz , his demeanor is much more presidential than Trump 's . permalink save parent edit disable inbox replies delete REPLY ",0
461.png,"U.S . Senator Bernie Sanders 8 hrs What do the Koch brothers want ? Let me tell you . They want to give Americans the freedom '' to live in poverty working for $ 3 or $ 4 an hour without healthcare , without childcare , without a pension , without the ability to send their kids to college , and without any hope that their children will have a higher standard of living than they do . In other words , the Koch brothers and the billionaire class want it all . OH REALLY BERNIE ? SO HOW COME ME AND MY BRO PAY OURWORKERSANAVERAGE SALARY OF $ 64,000 , DONATE MILLIONS TO HoSPITALS AND COLLEGES AND VARIOUS OTHER CHARITIESP imgflip.com ",0
462.png,I AM NOT BERNIE ,0
463.png,IS THIS REAL LIFE ? ! what if hillary clinton was in real life # Project Murph ,1
464.png,"ituted anten deriving their an ect , le te alter c it is the ach princ vent Donald TRUMP Sniffing MONTAGE PRESIDENTIAL DEBATE 2016 ",0
465.png,"[ deleted ] 353 points 2 years ago Gary Johnson , I can not afford the therapist I know I need and overall feel as if I have no future . I am just another poor person being squeezed out and left to dry by the ultra-rich . As someone wanting to run for president , what hope can you give me that the country being fiscally conservative ' is going to help me and my family reach that american dream of upward mobility ? What will individual freedom and liberty do to help my situation ? permalink embed save C-1 A GovGary Johnson [ s ] -475 points 2 years ago The best chance you have to reach the American dream is through entrepreneurship . Individual freedom and liberty will better allow you to do that . Create your own job do n't be a victim . Take control of your own future permalink embed save parent give gold ",0
466.png,THE MARCH S TYRANNY UNI NEXT TIME ILL VOTE REPUBLICAN GARRISON bergarrison.com . UGN NEXT TIME ILL VOTE DEMOCRAT/ ,1
467.png,IT 'S SO COLD saw a Democrat with their hands in their own pockets ,0
468.png,deserttson methlehem Never ask a British person about the price of Freddo 's abithehugslut answered you : whats the price of freddo 's deserttsong OKAY RIGHT SO BASICALLY FREDDO 'S ORIGINALLY COST 5 PENCE THOSE WERE THE GOOD DAYS THE HAPPY DAYS FULL OF JOY AND SUNSHINE AND CHEAP DELICIOUS CHOCOLATY TREATS BUT THEN THE ECONOMY WENT TO HELLAND CADBURY THE CHOCOLATE COMPANY WHO LITERALLY MAKE ALL THE GOOD CHOCOLATE IN ENGLAND WERE LIKE HEY LETS RAISE THE PRICE TO 8 PENCE AND EVERYONE WAS LIKE WE UNDERSTAND TIMES ARE HARD BUT THEN CADBURY RAISED THEM TO 10 PENCE LIKE OKAY DUDES WOH STOP THATS DOUBLE THE ORIGINAL PRICE AND THEN THEY RAISED IT TO 20 PENCE PER FREDDO THAT IS FUCKlNG BULLSHIT ONCE YOU COULD BUY 20 FREDDOS FOR ONE POUND AND NOW YOU CAN ONLY BUY 4 FUCK asked a British person about Freddo 's ,0
469.png,"73 % 1:01 PM K +1 559-376-7017 Great , thanks ! If you can , please bring a friend or two Have a great day ! 12:52 PM You too thank you 12:53 PM Thanks 12:57 PM FEEL THE BERN YOU WILL 1:00 PM 0/160 Add text ",0
470.png,"Donald Trump 's new campaign slogan : Make Great Again Smoking crack , A web of lies . for instance . The Gaza Strip The South . Hillary Clinton 's death stare . T HUMIDITY 2 cards Against Humanity ",1
471.png,TRUMP IS GON NA MAKE ME WORK FOR MY BENEFITS ,0
472.png,TRUMP AGREES WITH BREXIT AND THINKS IT 'S FANTASTIC ! THIS CA N'T BE A GOOD THING ,0
473.png,Feel The BERN ,1
474.png,"IFTRUMP LOSES Illegals will pour into our country . Our borders will be unsecured . China will put us further in debt . ISIS will not be destroyed and will thrive . The Constitution will no longer exist ! Our economy will NEVER ever recover . Radical Mslm will take control and destroy our way of life . Our Vets will die shamelessly No matter where you or your family go , you wo n't be safe . America will no longer exist ! Vote Donald Trump ! ",0
475.png,DISNEY-PIXAR FINDING FRANK OCEAN meANNIPCIURESm VIN PEEN l um l N E BERN WI IINAIAN FEM IRLI KTCNEJ AKIAEHIN MEALA REA SEM AL R M A AN ERŒ_ÄW EA AN¾¡ÓOM RAKI H �äÑERSEER STY REŽÐ£BRERAMET¾÷Î RK.FWU I ¾ª¦�Ò¦K1IST.MWKAEXRW NAMIBŽ__RIEEMIRAER •_ÄLELALIAŒ¼ÓDRJON.WUBAOMŒ�ÇIONARIMIERCREIIF ,0
476.png,"Bishop Earl Walker Jackson Sr . has issued a plea for all Christians to leave the Democrat Party Democrats boo 'd God 3 times at 2012 convention ! Democrats support abortion , and place Planned Parenthood clinics in minority neighborhoods . *Democrats reject the Bibical Family structure . *Democrats are openly hostile to those who express their Christian Value *Hillary says we must give up some of our principles *Democrats are hostile toward the display of a cross and public prayer . Democrats have turned their backs on God ! ",1
477.png,A flash mob to vote or a candidate ( especially Bernie Sanders ) ,0
478.png,MIKE PENC DONALD TRUMP PRESIDENT VICE PRESIDENT TREY GOWDY BEN CARSON SURGEON GENERAL ATTORNEY GENERAL JEANINE PIRRD ALLEN WEST SECRETARY DEFENSE SUPREMECOURILUSIC : NEWT GINGRICH SECRETARY OF STATE RUDY GIULIANI HOMELAND SECURITY DAVID CLARKE COMMISSION ON LAWENFORCEMENT ,0
479.png,`` BERNIE SANDERS IS 74 WEARS OLD AND STILL LOOKING FOR A JOB HAT COULD BE MORE AMERICAN THAN THAT ? '' TED ALEHANDRO ,1
480.png,Bernie or Hillary ? Be informed . Compare them on the issues that matter . Issue : Favorite Star Wars Character ? `` Wedge Antilles . The man fought in the Battle of Yavin . Survived a trench run on the first Death Star `` Jar Jar steps in while saving Luke . Took down an AT-AT on Hoth and helped lead the poopie ! the fight in the Battle of Endor The man is a hero in my eyes and should be celebrated . '' obvious plaat ,0
481.png,"BERNIE SANDERS BELIEVES EVERYTEAM DESERVES A SUPER BOWL , EVENTHE LIONS @ NFLMEMEZ ",0
482.png,Hillary Clinton Donald Trump Trebuchet Said some dumb bullshit Launch a 95 kilogram stone projectile over 300 meters ,0
483.png,"home US election 2016 world a all ME US elections 2016 Mike Pence 's plane slides off runway at LaGuardia airport in New York Mike Pence , the Republican vice-presidential nominee , has emerged unscathed after his ",0
484.png,BERNIE COLLAPSE VOTING ANYTHING THE CHANGE ,1
485.png,The I just got into politics a few months ago and did n't pay attention to economics and history in high school starter pack 2016 Bernin BERNIESANDERS COM Bernie FEEL 2016 THE BERN ,0
486.png,IREFUSETO DEBATTEMY PRIMARYOPPONENTBECAUSE IMFOCUSEDON THE GENERAL MYPRIMARYOPPONENTGETSTO DEBATE THE REPUBLICAN NOMINEE mgfip.com ,0
487.png,"Trump Foreign Policy Masterclass : Donald Explains The lran/Iraq War TRUMP PEN CE Virginia Beach , Vinginla `` Iran and Iraq were very similar militarily They 'd fight fight fight and then they 'd rest . They 'd fight fight fight . And then Saddam Hussein would do the gas . And somebody else would do something else . And they 'd rest . '' Actual Donald Trump quote from his foreign policy town hall meeting in Virginia Beach , VA , 9/6/16 DEMOCRATICUNDERGROUND , COM ",1
488.png,OPENING RIAL NOT SEEING RITHE DONALD ,0
489.png,IFA VOTE FOR ANYONE BUT TRUMP IS A VOTE FOR HILLARY THEN A VOTE FOR ANYONE BUT HILLARY IS A VOTE FOR TRUMP ,0
490.png,"hillary Clinton 's birthday ALL NEWS SHOPPING IMAGES VIDEOS Hillary Clinton Date of birth October 26 , 1947 ( age 69 years Place of birth Edgewater Hospital , Chicago Spouse : Bill Clinton ( m. 1975 ) ",0
491.png,"me : i hate liberals them : so what are you , a republican ? me : oldmin ",1
492.png,To should run as a Bernie Bernie is running that 's third party ! the only way to win ,0
493.png,"I Like Page While Obama flies around the country on Air Force One , accompanied by Crooked Hillary , with the president in plain sight campaigning for her , which is in and of wrong , yet in Kentucky we have the Democrat Attorney General of Kentucky going after a humble woman who went to jail over her belief that God intended marriage for one man and one woman . Beshear is also hot on the trail of our Christian Governor , filing one frivolous lawsuit after another . One may laugh but l fear we are n't far away from the Democrats in power herding the People of the Book into Commonwealth Stadium and unleashing the modern day lions upon us . Dm Kim Davis : Kentucky Clerk Who Refused Marriage Licenses Violated Open Records Act FRANKFORT , Ky. ( AP ) The Kentucky lawyer general 's office says an eastern Kentucky region assistant who made news When she declined to issue marriage ",0
494.png,Oh No ! Youve be cLOCKED in the FUGKANG PUSSY by Donald `` The C Trump ! LLOYDS Up VOTE i Conds or you 'll run out of e ! ,0
495.png,"FOR PRESIDENT SANDERS MOTO ddas FREE SHIT AT THE ACE HOTELTHEATER LOS ANGELES , CALFORNA FEBRUARY FFTH 2016 BERN ! ELTHE ",1
496.png,updated her profile picture 21 hrs . l sent in my absentee ballot and I 'm feelin the bern in my favorite Bernie underwear . Friendly reminder to vote in the primary tomorrow ! Also a friendly reminder not to sexualize the female body . ,1
497.png,Hillary for Prison 2016 wwww.hDanylonprison com CENTENNIAL 1812-2012 NEW MEXICO LAND OF EN CHANTMENT ,0
498.png,Why is Bill Clinton looking like he 's got a case of the suds AN SA ,0
499.png,"WHO HAS THE BETTER DISSP NOTBILLWALTON You a fan , a phony , a fake , a pussy , a Stan Trump is a phony , a fraud , his promises are whip your ass , you 3G in a karate class as worthless as a degree from Trump univers ",1
500.png,"TRUMP-PENCE TRUMPETS '' YES THE `` TRUMP OF GOD ( 1Corinthians 15:51 ) & ( 1Thessalonians 4:16 ) October 2nd , sunset JerUSAlem time , begins Hebrew Year 5777 ! ! ! HUNDREDS OF SIGNS FOR THE FIRST TIME EVER AN UNPRECEDENTED EPIC CONVERGENCE EXAMPLE : muslim turks take JerUSAlem in 1517 and lose it to General Allenby EXACTLY as predicted 8 Jubilees later on the first day of Hanukkah in 1917 . Then the NEXT Jubilee is the `` Six DAY WAR '' in 1967 . EXACT ! Wow , already the next Jubilee is here ! Be Rapture Ready or as Jesus Warns us plainly , you will remain here for the Tribulation which will be `` the worst time that ever was or ever will be '' Think of it..just one EMP and lights out ... no food no water no transportation.. riots ... fires ... oh and hundreds of nuclear storage pools overheat and nuclear fires everywhere just like F US-hima ! 9 SEE Hundreds of Proofs at my Facebook page U DoD ) Like Reply 1 41 mins ",1
501.png,"Give a man a fish , and he eats for a day . Give a man a welfare check , a free cellphone , food stamps , section 8 housing , a six-pack of beer , a crack pipe , and some Air Jordon 's , and he 'll vote Democrat the rest of his life . ",1
502.png,Republican Party Cas Busken 2016 Presidential Cookie Poll Democratic Party Cookie Party en Dy vote VOTED ,1
503.png,"GIRIS ! WHEN YOU GET DONE WOONINGONERA PORNOU , ICMULD USEA LITTLE ELPI JUST MOTHER . BERNIE ",0
504.png,"I 'm voting for Hillary because I don ' t want Trump to get in He 's bad news and wil cause a lot of people to suffer Causing Libya to fail ? Robbing Haitians of their relief funds ? N Destabilizing Syria and Iraq ? Selling billions of dollars of arms to the Saudis ? haha , they 're not American , that does n't count : P ",1
505.png,POLICE SAYS HE 'S UPSET DONALD TRUMP STATED WE ARE ONLY GETTING THUGS AND CRIMINALS FROM MEXICO . BURNS COP CAR ... YOU KNOW ... TO PROVE TRUMP WRONG mematic.net ,1
506.png,LTE 55 % 4:55 AM QO The Economist Briefing : The Labour Party Salvaging Jerusalem How Britain 's left got into its crisis-and how it can get out United States Trump and the Alt-Right Pepe and the stormtroopers How Donald Trump ushered a hateful fringe movement into the mainstream ,1
507.png,"Dad , do we Feel The Bern ? No , son . We have responsibilities and contribute to society ",0
508.png,"/R/FULL COMMUNISM hot new rising controversial top Gilded promoted view images ( 21 ) Do you agree Hillary Clinton is lying about the Clinton Foundation ? Sign the petition ! Paid for by Donald J. Trump for President , Inc promoted by Comrade the-realDonaldTrump save hide report Citizen O promoted post what 's this ? ",1
509.png,MELANIA TRUMP GIVES ONE SPEECH ABOUTIETHICSAND STANDARDS ,0
510.png,"I am SOOOO Confused ... .. If Trump ls the Hate-Mongering Candidate , Why Are n't HIS Supporters Murdering Cops And Innocent People ",0
511.png,"Me : Hillary oversaw a coup in Honduras which installed a regime that murders indigenous rights activists Democrat : DO YOU WANT TRUMP TO WIN 3/3/16 , 4:48 PM ",1
512.png,Bernie or Hillar Be informed . Compare them on the issues that matter . SUPER BOWL Issue : HALFTIME SHOW `` I wish it were `` Woo ! Play just BeyoncÌ© '' 'The Scientist ' '' ,0
513.png,"playas we ai n't the same , I 'm into Kaine and guns VAATE ",0
514.png,"nou can not help men permanently by TRUMP PENCE doing for them what they could 2016 and should do for themselves The stronges eason forthe people to retain the rightio keep and beararmsis , asalast resort , to protectthemselves against tyrannyingovernment . OCT IN GOD WE TRUST 16 DONALD TRUMP FOR PRESIDENT 2016 IN NEWS OVER AMILLON COPS OUR STREETS TODAI ",0
515.png,`` Hillary Clinton is unfit to be President ! '' 4 Weeks Ago `` We must all support Hillary Clinton ! '' Today ,0
516.png,"Chronic Hoosier @ Chronic Hoosier To everyone around the country just now googling Mike Pence , our sincerest apologies -signed , Indiana 7/14/16 , 9:56 AM 456 RETWEETS 502 LIKES ",1
517.png,Cassidy 25 mins Literally where is Clinton getting her polls from ? I 've spoke with dozens of people and have yet to find Clinton supporters # Trump 2016 Comment Like Share ,0
518.png,"my history my staunch democrat teacher always praises students who give other students a green scantron when those students forgot to bring one He says `` wow look at the socialism in the room , maybe bernie has a chance after all '' ",0
519.png,`` Imagine Donald Trump sitting in the situation room `` Deciding wether to send our troops into battle '' . ,1
520.png,"o 28 % 1:19 PM 76 AT & T M-Cell Details Dad Messages Text Message Today 1:15 PM this guy Bernie Sanders is going to bankrupt our country , son No he 's not Dad he is really kewl he is ? i didnt know that It 's true . He is very kewl and awesome I learned about it on Reddit youve convinced me . i am feeling the bern I love you dad i love you too son O Text Message Send ",0
521.png,"Bernie or Hillary ? Be informed . Compare them on the issues that matter . Issue : The Weed Man $ 15/G mids is Got that straight Cali all I got . Text Dank , 2G for $ 20 . Swing you in a few through and Feel The Bern . hours when I am free ",1
522.png,Would you kill a bourgeoisie end World hunger ? So Vou re gon na et millions of people starve for one stupid bourgeoisie VOTE DEMOCRAT I do n't like to abuse eople . VOTE DEMOCRAT ,0
523.png,WHEN YOU FIND OUT SOMEONE YOU THOUGHT WAS A FRIEND SUPPORTS HILLARY CLINTON BLOCK 1776 REBORN ,0
524.png,Donald Trump : The strongest Mexicans will be allowed to stay ... if they survive the annual Hunger Games Hillary Clinton : Hey teens did you check out my new Arthur meme on Instragram ? It 's really checks notes woke ? Gary Johnson : I know we 're in a debate but man am l craving doritos right now Jill Stein : GMOs cause autism ,0
525.png,Donald Trump isthe first person Ive ever seen that nobody likes yet may be elected president THE P 1374 He 's The Big Bang Theory . '' Darrell Dawson youtube.com/dawsoncomedy ,0
526.png,"And Bill Clinton gave a So Bernie Sanders gave a speech praising Hillary 12 speech on marriage ? Yes . Yes . And Obama gave a speech Boy , what I 'd give to be about the dangers of an a shovel salesman in uncontrollable president ? Philadelphia this week ! Yes . Me too . FaceBook com/LiberalLogic10 http : /Liberal Logic 101.com ( We do n't mind if you download and share this image , just leave the attribution . ) ",0
527.png,"Anonymous 05/21/16 ( Sat ) 18:37:04 No.338437809 338438117 File : 1459704054948.gif 263 KB , 600x304 ) A liberal Muslim homosexual ACLU lawyer professor and abortion doctor was teaching a class on Karl Marx , known atheist `` Before the class begins , you must get on your knees and worship Marx and accept that he was the most highly-evolved being the world has ever known , even greater than Jesus Christ ! At this moment , a brave , patriotic , pro-life Navy SEAL champion who had served 1500 tours of duty and understood the necessity of war and fully supported all military decision made by the United States stood up and held up a rock . `` How old is this rock ? '' The arrogant professor smirked quite Jewishly and smugly replied `` 4.6 billion years , you stupid Christian ' Wrong It 's been 5,000 years since God created it . If it was 4.6 billion years old and evolution , as you say , is real ... then it should be an animal now '' The professor was visibly shaken , and dropped his chalk and copy of Origin of the Species . He stormed out of the room crying those liberal crocodile tears . The students applauded and a registered Republican that day and accepted Jesus as their lord and savior . An eagle named `` Small Government '' flew into the room and perched atop the American Flag and shed a tear on the chalk . The pledge of allegiance was read several times , and God himself showed up and enacted a flat tax rate across the country . The professor lost his tenure and was fired the next day . He died of the gay plague AIDS and was tossed into the lake of fire for all eternity ",1
528.png,DOG TURDS FOR TRUMP 2016 PENCE ,1
529.png,"St. Louis 8:37 AM CT HILLARY NICKELBACK 2nd PRESIDENTIAL DEBATE LIVE ON CNN TONIGHT # CNNSOTTU LIVE TRUMP : `` I WILL NEVER DROP OUT OF THE RACE '' l CNN Amanda Carpenter CNN Political Commentator 9:37 AM ET STATION , LONG ISLAND RAIL ROAD SPOKESMAN SAYS ABOUT 600 PAS STATE OF THE UNION ",0
530.png,A comic starring : Jay Ferris bfan 1001 flea comic by Septapus The internet needs a lot of fixing in genera Anyone have windows vista or know how to fix the internet for thats why im voting for al gore `` fix the internet '' is a broad request I dunno I hear Jill Stein has a great plan to decontaminate our WiFi ,0
531.png,COD HATES HUNTER PENCE ,0
532.png,WHY IAM VOTING FOR TRUMP REPUBLICAN PARTY ,1
533.png,I HATE THE GOVERNMENTSO I VOTE REPUBLICAN TO TRY TO SHRINK IT FUCK ME RIGHT made on inngur ,1
534.png,"CNN Politics Like Page 2 hrs Maybe we could have , like , a task force to go to Area 51 Hillary Clinton says Hillary Clinton Gokingly pledges UFO probe WWW . CNN.COM BY ELI WATKINS , CNN 454 Likes 317 Comments 217 Shares Like Comment Share ",1
535.png,Donald J. Trump arealDonald Trump 2 hours ago We 've all wondered how Hillary avoided prosecution for her email scheme . Wikileaks may have found the answer . Obama ! nationalreview.com/article/ 4411 15 In reply to 43 seconds ago ankit sharma @ ankit 5566 @ real Donald Trump hindu love trump via Twitter for Android ,0
536.png,"WE 'RE FUCKED , MOVE TO CANADA I STILL FEEL YOU BERNIE ! I STILL FEEL YOU ! P ",1
537.png,"Ya Boi Bernie Apr 30 at 6:48pm B oh noe ! if you come upon this image while scrolling you have been visited by DAT BOI BERNIE ! Comment `` o shit waddup '' in 42069 seconds and you will be blessed with student loan forgiveness , or else you will be doomed to suffer at the hands of the yuge corporashuns and smoke only mids forever o shi Wadd ",1
538.png,@ NFL Memes Narrowing 318 million people down to Donald Trump & Hillary Clinton for President is like narrowing the entire NFL down to having to pick between Ryan Fitzpatrick & Blaine Gabbert for your fantasy team ,0
539.png,"School M8 with X and X 23 April at 16:55 In order to be correct l 'm sometimes I 'm politically incorrect . Thats wh intelligent people like what say . You know when your speaking truth because you receive a lot of hate . Thats why Jesus Christ , me , Donald Trump and Martin Luther King are considered controversial . 2 were killed for it . For speaking truth . Like Comment Share View 7 more comments some guy : take a chill pill ! Like Reply 1 Yesterday at 00:12 ",1
540.png,19.6 O N/A Bernie Sanders ersMan Builds A Dog Train To Take Rescued Stray Dogs On Adventures in memeland ,0
541.png,"NGSTOWN HIO AUGUST 15 Rudy Giuliani : Former New York City Mayor Says There Were No Successful Terror Attacks 'Before Obama ' Giuliani said there were no successful radical Islamic terrorist attacks in the U.S. in the eight years before Obama was president , and that they `` started when Clinton and Obama got into office . '' YOU WENT FULL RETARD NEVER GORULLRETARD . ",0
