image_path,sentence,label
108.png,"Jared Pierce 18 turns o he hourglass I lived in Russia 1993-95 , right after the Soviet Union fell . l know and lived in the real effects of socialism stood in the bread lines , potato lines , meat lines , egg lines and most any other LINEs . These lines sucked hope and prosperity from the souls of men . Bernie and his millennial minions have no comprehension of the damage and lasting effect of such policies . May we GOP Americans find a real true blue American Capitalist to support is my prayer . Most younger kids ( 18-30 ) have no understanding of these difficult times their forefathers fought against . Like Scrawl yer thoughts 21 ",0
109.png,S20 SAYS THIS GUY VOTES DEMOCRAT ,0
110.png,"shared SubjectPolitics 's video 2 hrs It 's sad when you make the 74 year old socialist look good in comparison to you HILLARY CLINTON PLAYING THE `` NoMAN CARD '' COUNT : 1 SubjectPolitics com 1:21 IX 1,443,217 Views SubjectPolitics Like Page April 28 at 3:29am Hillary Clinton plays the Woman card 13 times in a MINUTE ... Like Comment Share she could make osama bin laden look good Like Reply 1.1 hr . Edited ",1
111.png,Jommen is starting to Feel the Bern ,0
112.png,WHO RUN WORLD2 VY PARK Milk the Cow Podcast Like Page Yesterday at 8:40am . BeyoncÌ© pays the sweatshop workers who make her lvypark range 44 pence an hour and in the same breath preaches empowerment . ,1
113.png,"Go over there to see which Presidential candidate is best for you . The Republican nor the Democrat . `` I do n't like either of them . You Just do n't under stand Vote for Vote for me , me , you pussy ! '' you ass our System ",1
114.png,FEEL THE BERN ,0
115.png,"Many in the GoP keep calling Donald Trump a liar and manipulator . To me , liars and manipulators are 301 Republicans who were elected to the HOUSE and SENATE that PROMISED to stop Barack Obama and his godless Democrat Party 's destruction of America ... BUT DIDNT STOP ANYTHING ! ",1
116.png,Trump : GOP will become worker 's party ' under me By NICK GASS l 05/26/16 O7:44 AM EDT ,0
117.png,BARNIE STALIN FEEL THE BERN ,0
118.png,"Imagine if I started a hip hop career . And then l threw an underground concert and I claimed that the concert was awesome because 10,000 people showed up and cheered like crazy . But then a bunch of evidence is revealed that indicates only like eight people actually showed up and that I was completely bullshitting . At that point , everyone would believe that l am mentally deranged or that I am the biggest liar on the face of the earth . Nobody would say that I am exaggerating because that would be FAR too generous This is no different than what Donald Trump did with his outlandish `` I saw many thousands of Muslims in New Jersey cheer on 9/11 '' claim . Except for one thing . Many people still believe him or say he was `` slightly exaggerating ",0
119.png,Donald Trump winsthe Oscar for Lead Actor in a Comedy Film for his outstanding work in the GOP Presidential Debates ! ,1
120.png,"MINNESOTA GOVERNOR RAISESTAXES ONTHE RICH TO BOOST EDUCATION FUNDING RAISES THE MINIMUM WAGE AND SIGNSANEQUAL PAY LAW STATE BECOMES THE FIFTH FASTEST GROWING ECONOMY IN THE US , UNEMPLOYMENT DROPS TO JUST 3.2 % , ITS $ 2.6BILLION DEFICIT BECOMESA $ 1BILLIONSURPLUS , AND ITS ECONOMIC CONFIDENCE RISESTOTHE HIGHEST OF ANY STATE AMERICANS AGAINST THE REPUBLICAN PARTY ",1
121.png,George Bush do ya thing TRUMP ,1
122.png,HILARY CLINTON MAKESIOKES ABOUT COLORED PEOPLETIMEBUT LIBERALSSCREAMTRUMPISTHERACIST BUT THATS NOT OF MY BUSINESS gflip com ,1
123.png,Clever bot Dank memes . Hi mc donald . Dank memes . Just do it . Dank memes . Ok . share ! Dank Memes think about it think for me thoughts so far ,0
124.png,threedogs toaster The Mother Trump feeds it 's Trumplings a small loan of a million dollars ,0
125.png,"James Saint-Francia sirjamesa12 Get you a liberal who can do both Brianna Wu Violence has no place in politics @ Spacekatgal Violence has no place in politics Violence has no place in politics White People To Do List Violence has n 1 . Recognize privilege 2 . Educate self on structul 3 . Amplify black voices 4 . Shut mouth and listen Protesters attack Trump supporters outside San Jose rally 1,058 1,122 Tnump supportars were attackat and one officer was assaultad durin9the pr test 2:09 PM 18 Jun 2015 89 ",0
126.png,Bernie or Hillary ? Be informed . Compare them on the issues that matter . Issue : here come dat boi o shit *Here comes that boy . waddup obvious plant ,0
127.png,"Blame The Black Guy yeah , Hillary , I do n't care if you try to blame your decision to use an unsecured email server on a black guy just so long as I 'm not the black guy you 're blaming ! CARTOONS by Hen www.cartoons hen Com Copyright Henry Christensen , 2016 ",1
128.png,Aw look how cute Oh no I 'm voting Democrat this election cycle . It 's retarded . ,0
129.png,o shit waddup ! BERNIE SANDERS COM ,1
130.png,"riday , 15 January 2016 at David Bowie 69 Alan Rickman 69 fingers crossed guys Donald Trump Age 69 June 14 , 1946 Like Comment Share 23 people like this . Write a comment . ",1
131.png,HILLARY CLINCHES NOMINATION VOTE FOR BERNIE SANDERSANYNAY inngflip com ,0
132.png,"My rural neighbor is a hippie Bernie supporter and his dog got loose . Guess what I did ? NEIGHBORS BTFO ( self , The Donald ) submitted 6 hours ago by to /r/The Donald 158 comments share [ I I put on my MAGA hat , coaxed him into my car and drove the 1/3rd of a mile to his place . When I saw my neighbor , Itold him that I caught his dog illegally entering my country , and that I was deporting him . My neighbor laughed and offered me a beer , because we both understand that people with different political viewpoints can still be good neighbors . ",0
133.png,"ONE IS A STATISTDEMAGOGUE WITH MILLIONS OF DELUSIONAL FOLLOWERS LEADING the WWAY ADD YOUR NAME Paid for by Donald J. Trump for President , Inc . THE OTHER ISVLADIMIR LENIN Please research Gary Johnson . ",0
134.png,"REVOLUTIONARY CHANGE YOU MEAN LIKE CAMPAIGNING FOR BERNIE SANDERS , RIGHT ghip.com ",0
135.png,BERT ERNIE BERNIE ,0
136.png,LEAKED PHOTO : Mike Pence grabbing a pussy ,1
137.png,1943 Hiroshimna DetrOIt ZO 1 CD Hiroshima Detroit THE LESSON ? It 's easier to come back frorn a nuclear strike than five decades of Democrat control of government . THEHAYRIDE.COM ,0
138.png,"`` This Will Be The End Of Bernie 's Campaign , '' Says Increasingly cucked SMALL REDDITOR ",0
139.png,ITS TRUE I WACKY OFF EVERY NITE TO A PICTURE OF BERNIE ,0
140.png,"I do n't believe that women have any rights , and I think gays should be hanged . No , actually , l 'm a Muslim and those are my religious beliefs . Wow , what a complete 4 primitive asshole you are ! You must be a Republican . Oh ! I 'm sorry ! apologize ! I hope you do n't think I 'm Islamophobic ! ( c ) 2016 Dixon Diaz ",1
141.png,"Wun the advent of Donald Trump/Hillary Clinton to join the oligarchy of the American political structure , Donald a demagogue and true ultracrepidarian , and both with a mental scotoma of any gnostic perspective of life , i as an autodidact , offer a solemn adjuration , everyone is in some way my better and in that i LEARN 3 hours ago Like Reply ",0
142.png,"Anonymous ( ID : mHMIfKBM ) 06/24/16 ( Fri ) 12:04:04 No . 78570860 File : toupees ng ( 287 KB , 497x294 ) All I know is that when Trump and Boris are both elected leaders , they 'll be like toupees in a pod ",1
143.png,Alton Sterling : Father of 3 sentenced to immediate death by law enforcement after selling CDs outside a gas station . America Hillary Clinton : Carelessly allows Int ' l access to Top Secret Government info with no consequence from law enforcement . ,0
144.png,"Bernie Sanders @ Bernie Sanders 10h how do craft redstone ? V 2.2K Donald J. Trump @ realDonaldTrump 7h Bernie Sanders you ca n't craft redstone . You have to mine it , dummy . 5.3K ",0
145.png,Bernie or Hillary or space socialism ? Be informed . Compare them on the issues that matter . Issue : space `` Space is both the `` What we need to `` I met James metaphor for the limitless worry about is the Armstrong aspiration of our 1 % here in 'Murica revolution and the canvas once and he blah blah blah '' on which we shall paint the was very tall '' future ,0
146.png,Shares Y C are SCORE ! One Pence Two Pence Three pence Four Four Pence Three Rence Trump Pence ,0
147.png,SO HILLARY AND BERNIE ARE DEBATING SOCIALISM AND CRUZ IS BUSY WITH CAITLYN JENNER 'S FACEBOOK VIDEO on Ingur ,0
148.png,"Oh , I feel it Feel the Bern Kronk ",0
149.png,"HILLARY SCANDALS TRUMP SCANDALS called some women fat 20 yearsago 4 dead Americans in Benghazi Supportedarming Syrian jihadists , which led to rise of ISIS Supported toppling Gaddafi , which led to International migrant crisis Private e-mail server . Lied under oath about it . Took Clinton Foundation donationsfrom countries that oppress women . Clinton Foundation pay for play . Intimidated Bill Clinton 's rape victims laughed about defendingachild rapist . Called KKK leader Robert Byrd her mentor . Russian uranium deal . Rigged primaries against Bernie lied to media about her health ",0
150.png,IF HILARY CLINTON WINS IN 2016 IT WILL BE THE FIRST TIME TWO PRESIDENTS HAS HAD SEX WITH EACH OTHER ,1
151.png,"APRIL 27 , 2016 Cruz Hopes to Tap Into Immense Popularity of Carly Fiorina BY ANDY BOROWITZ Political insiders called the choice of the wildly adored Fiorina a game-changer for the Cruz campaign . APRIL 25 , 2016 Koch Brothers Consider Purchasing First Democrat BY ANDY BOROWITZ The two considered acquiring a Democrat only after determining that none of the Republicans was worth adding to their collection . APRIL 22 , 2016 Trump Reassures Supporters That He Still Opposes Women Who Were Born Women BY ANDY BOROWITZ After expressing tolerance toward transgender people , the candidate clarified his position on women in general . ",1
152.png,DEMOCRAT SALSOVOTEDAGAINSTGUN CONTROL TODAY ANDTHE PERSON RESPONSIBLE FORTHENATIONtSBIGGEST MASSSHOOTINGISAREGISTEREDDEMOCRAT BUT THATS NONE OF MY BUSINESS ,1
153.png,"Donald Trump and Barack Obama somehow ended up at the same barbershop As they sat there , each being worked on by a different barber , not a word was spoken . The barbers were even afraid to start a conversation , for fear it would turn to politics . As the barbers finished their shaves , the one who had Trump in his chair reached for the aftershave . Trump was quick to stop him saying , 'No way buddy , my wife will smell that and think I 've been in a damn whorehouse . The second barber turned to Obama and said , 'How about you ? ' Obama replied , 'Go ahead , my wife does n't know what the inside of a whorehouse smells like ",1
154.png,"re : Hahahahha from Trum sent 46 minutes ago Typical , lying democrat . Proving once again , that you all lie . You ca n't help it . Enjoy the cancer , I enjoy my next beer that much more knowing you 'll be dead sooner than me . permalink report b user mark unread reply ",0
155.png,A cop voting for a Democrat IS like a chicken voting for Colonel Sanders Police Officers fb ,1
156.png,"A Gary Johnson Super PAC Spent $ 30,000 on `` Internet Web Memes '' gawker.com You and 3 others 1 Comment Like Comment Share ",0
157.png,"My mom got kicked out of her emotionally abusive home at age 16 . She took out loans and paid for herself to graduate high school early and go to college early and go to medical school early and become a doctor , all without any financial or familial support . Her parents did n't go to college . She became an anesthesiologist . She married a bad man who left her four months after she gave birth to twin babies . He never came back or financially supported her or her children . He has n't spoken to her or me or my brother in nearly fifteen years . She worked hard so l could work hard . l was the first person in my family to go to Harvard . It was harder because I was a girl , and people do n't like girls that much , generally . I worked hard there and I worked hard after . I understand your criticisms . I understand that the American dream is broken , and that my mom 's bootstrappy story is atypical and nearly unattainable , especially for people of color . But this did happen to my mom , and I am happy she gets to see a woman president in her lifetime . This is a huge day for incredible women like my mom and Hillary and everyone else . Also I will delete your posts if they are aggressive orthreatening . respect Bernie and his supporters and l did n't go to your wall to tell you to kill yourself . ",0
158.png,"Donald trump 1998 FIWERE TO RUN , ID RUN ASA REPUBLICAN , THEY RETHE DUMBEST GROUP OFVOTERS IN THE COUNTRY , THEY LOVE ANYTHING ON FOXNEWS . ICOULD LIE AND THEY 'D STILL EAT IT UP I BET MY NUMBERS WOULD BE TERRIFIC . PEOPLE MAGAZINE , 1998 ",0
159.png,February 3 at 6:30am The differences ... `` I vote Republican . I vote Democrat . lown my own business . I pooped myself A Share 48 people like this . 16 shares Now that 's funny 1 February 3 at 11:05am at about covers it ! 1 February 3 at 5:53pm https : //www.youtube.com watch ? v 1fuSqSyTdzQ Rag OnA Stick ( Extended ) httpd/www.ingeniouspress.com ,1
160.png,"TRUMP OR HILLARY ? IM COMING , HARAMBE ! ",0
161.png,WE SHOULD BUILD THE WALL AROUND DONALD TRUMP made on imgur ,1
162.png,"... oo Sprint LTE 9:10 AM o 44 % Tweet Liked by and 2 others v ME : anyone but trump GARY JOHNSON : will outlaw schools . JILL STEIN : Crystals are the only technology we need . ME : ok hillary i guess 8/13/16 , 11:11 AM 5,556 RETWEETS 10.5K LIKES Reply to drewtoothpaste Home Notifications Moments Messages Me ",0
163.png,"OFFICIAL BERNIE SANDERS DRINKING GAME ! Every time The Bernster mentions a free government program , chug somebody else 's beer ! ",0
164.png,"Gary Johnson 's Meme Stash 4 mins . Wait , are you guys really libertarians ? You know that capitalism killed ~500,000,000 people from hunger , disease and wars in the 20th Century alone , right ? Not to mention the atrocities carried out by the US and Britain in the 19th century . How can you justify that ? I Like Comment Share Be the first person to like this . ",1
165.png,BERNIE SAN-DOES WHAT HILLARY CLINTDONT mgflip.com ,0
166.png,"T 20 % , 10:28 PM OO AT & T freep.com Detroit Free press Metroid e ress Hide Caption A Political reporter Kathleen Gray and Free Press pollster , Bernie Porn , of EPIC-MRA , discuss the shift as part of USA TODAY Network 's Facebook Live 2016 series . POLITICS New poll shows Clinton and Trump nearly tied in Michigan Aa Todd Spanaler Detroit Free Press ",0
167.png,"Boombox IF ALL AMERICANS WERE POOR , DEMOCRAT . By Dixon Diaz AND IF ALL AMERICANS WERE RICH , THEY 'D ALL VOTE REPUBLICAN . with apologies to Aaron McGruder WHICH EXPLAINS THE DEMOCRATIC PARTY 'S STRATEGIES ABOUT POVERTY . ",1
168.png,IF CLINTON HAS TO DROPOUT SANDERS IS THE NOMINEE WUZU.SE ,0
169.png,"WeRateDogs Follow @ dog rates This is Bernie . He just touched a boob for the first time . 10/10 RETWEETS UKES 2,626 6,421 ",1
170.png,WOMEN SUPPORT Equal ight BERNE SANDERS LAPOR ' Equal Pay For Equal Work omen Bernie ,0
171.png,THINK THAT SOONER OR LATER IRITHE DONALD WILL BE BANNED BY THE ADMINS made on inngur ,0
172.png,THIS IS A WALLINSIDE A NAZI GAS CHAMBER dwebs WHEN A DEMOCRAT MENTIONS GUN CONTROL REMEMBER THIS PICTURE ,1
173.png,WE HAVE PROOF THAT TRUMP GAVE A SPEECH OPPOSING NAFTA BEFORE IT WAS PASSED . GET THIS TO THE TOP . LIVE ( i reddit ) Submitted 6 hours ago by Gullo11 O I-1 187 comments source share save unhide give gold report hide all child comments What rule does this break ? No Spamming No Trolling No Racism No Releasing Personal Information O No Vote Manipulation or Brigading ,0
174.png,TFW you endorse Hillary and now you can chill for the rest of the summer ,1
175.png,"http : // gic10 L OCICLO com `` Bernie Sanders is now free to gic ttp vacation in Venezuela and enjoy watching his ideas put into effect . '' ttp ttp ralLogic1 htL : 1.com http John Hayward : //LiberalL dalLogic10 http : //Lib com http : //LiberalLo FaceBook.com/LiberalLogic101 http : //LiberalLogic101.com ( We do n't mind if you download and share this image , just leavetheattribution ) ",0
176.png,"Minu TRUMPTEEING OFF PRAISES BRITISH FORTAKING COUNTRY BACK news SONY `` And call it America ll , and make it great again Trump , probably ",0
177.png,"WVTM 13 13 3 hrs Malala Yousafzai , the Pakistani teenager and Nobel Peace Prize winner , condemned Donald Trump 's controversial plan to ban Muslims on Tuesday Trump would temporarily ban all Muslims from entering the U.S. , a proposal that has rocked the Republican fie ... Malala : Trump 's plan is full of hatred ' WWW WVTM 13.COM BY BY THEODORE SCHLEIFER CNN Like Comment a Share Top Comments 18 people like this . 1 share oo bad the bullet did n't work . Lmao Like Reply 2 35 mins ",1
178.png,"V FULL SPEECH : Donald Trump Republican National Convent Et ABC15 Arizona 67,247 view aoC REPUBLICAN NATIONAL CONVENTION ARIZONA 57:42 1:16:41 ",0
179.png,"`` The other thing with the terrorists is you have to take out their families , when you get these terrorists , you have to take out their families . They care about their lives , do n't kid yourself When they say they do n't care about their lives , you have to take out their families Donald Trump , December 2nd , 2015 ",1
180.png,"TRENDING Karl Marx Chinese State Media Promotes Rap Song Admiring 19th Century German Philosopher Cretaceous-Paleogene Extinction Event Killed Off Marine Animals in Addition to Dinosaurs , Study Says Hillary Clinton : Presidential Candidate Remains Winner of Kentucky Primary After Recanvass of Votes See More ",1
181.png,Black lives matter ! Trump ! FBI ! Dallas Police ! Hillary ! Pokemon ! 2015 ,1
182.png,FACEBOOK RIGHT NOW Dallas Police ! Black lives matter ! Hillary ! Trump ! FBI ! Pokemon ! ,1
183.png,"The Democrat Party is the world 's most successful hate group . It attracts poor people who hate rich people , black people who hate white people , gay people who hate straight people , feminists who hate men , environmentalists who hate the internal combustion engine , and a lot of bratty college kids who hate their parents . However , the real secret of the party 's success is that it attracts the support of journalists who hate Republicans , and who therefore work tirelessly to convince the rest of us that we should vote for Democrats . ",1
184.png,SAYS HE IS A BLUE COLLAR SELF-MADE MAN SAYESHEISA BLUE COLLAR SELFaMADEMAN Gary Johnson 2016 ISAN ACTUAL BLUE NOT A ECO COLLARSETF MADE SELF-MADE MAN MAN ,1
185.png,"shared l Will Say and Post Anything I Want V About Barack Obama 's photo . 10 hrs Ca n't get hired , would n't work if they could ... . BERNOUTS UNITE ! Looks like a gay pride parade . Max dmdlablck BERNIE SANDERS RALLY Like Comment 18 Useful idiots Like Reply 10 hrs LOSERS ! Like Reply 9 hrs ",1
186.png,facebook.com The Donald Wants to be president . Describe him in two words : DESCRIBE RIM IN WO WORDS 198 890 O I Like Comment Share 856 of 890 Smart ,0
187.png,WHY DID BOTH CHICKENS CROSS THE ROAD ? TO AVOID DEBATING BERNIE SANDERS inglip.com ,0
188.png,"STRONG TOGETHER STRONG TOGETHER Hillary Clinton , seen here with Bernie Sanders , was purged in 2016 . Following her execution , Clinton was edited out of the photo by cabinet censors . Such a retouching was common during Sanders 's rule . ",0
189.png,BREAKING NEWS ! ALD TRUMP IS ,1
190.png,Happy Mother 's Day ! The best tampons are dispensed in Trump lower lavoratory I love women ! I I I I I Kotex ,0
191.png,BERNIE ,0
192.png,"Cedar Rapids ashington , DC 12:55 55 PM ET 11 DAK LIVE BREAKING NEWS CLINTON LANDS IN IOWA AS FBI REOPENS EMAIL INVESTIGATION /CNNU WOLF F OF THE YEAR CONSUMER CONFIDENCE ALSO HIT A NINE-YEAR HIGH L DO I HAVE TO GO OUT THERE ? Hillary ",0
193.png,ID LIKE TO SEE GARY JOHNSON CLIBRETARIAN CANDIDATE ) IN THE NATIONAL DEBATES FUCK ME RIGHT made on imgur ,0
194.png,Will be the greatest Jobs president that God ever created Donald Trump ,0
195.png,"Seemingly everyone in town proudly arrived at the final pro-Trump rally . However , Kermit ca n't help but feel sad knowing his explosives are set to detonate at any moment now , taking him and those surrounding . With a lump in his throat , he whispers his final words , `` Allahu Akbar '' ",0
196.png,HERE COME JOHNSON 2016 FACEBOOK REASONABLE PEOPL FOR GARY JOHNSON ,0
197.png,Bernie Sanders sat on the bus with Rosa Parks Where was Hillary Clinton ? ! ,0
198.png,This U.S. Marine was captured during a daring daylight raid . But not before he single handedly took out 13 combatants . Donald Trump would 've deported him for being Muslim . Share if you 're against Islamophobia . ,1
199.png,DIDNT LIKE THE REPUBLICAN INCUMBENT ELECTED ADEAD DEMOCRAT TO SENATE ,0
200.png,"Lie Detector Reveals Bush 's Secret are you a are you reptilian a closet shapeshifter Democrat , Bush-chan ? Bush-chan ? Did you d 9/11 , Bush chan ? I Bus IS IT a -- a gore . ",1
201.png,"submitted 5 hours ago by let-the-mother-bern to /r/Documentaries 80 comments share save hide report Snails use two brain cells to make 50 1745 Complex decisions , a team of Scientists has found . Researchers at the University of Sussex said one cell told the snail if it was hungry while the other cell told it if food was present Animal Science bbc.com submitted 5 hours ago by Libertatea to /r/science 76 comments share save hide report view more : prev next or try a random subreddit ",1
202.png,2012 Cao Bernie 2016 GREENPEACE THIS ENDLESS WAR against I 'm next wat the BERNIE SANDERS COM Obama ,1
203.png,"I do n't believe that women have any rights , and I think gays should be hanged No , actually , I 'm a A Muslim and those are my religious beliefs . Wow , what a complete primitive asshole you are ! You must be a Republican . Oh ! I 'm sorry ! I apologize ! l hope you do n't think I 'm Islamophobic ! ( c ) 2016 Dixon Diaz ",1
204.png,"5 ( Recent ) worst Mass Murders America , with a Firearm 1 . Ft Hood : Registered Democrat/Muslim . 2 . 2 . Columbine : Too young to vote ; both families were registered Democrats and progressive Iiberals . 3 . Virginia Tech : Wrote hate mail to President Bush and to his staff . 4 , Colorado Theater : Registered Democrati staff worker on the Obama campaign ; occupy Wall Street participant ; progressive liberal . 5 . Connecticut School Shooter : Registered Democrat ; hated Christian All of These Shooters were , Progressive Liberal Democrats Stephen EHughe ",0
205.png,"CREATORS , caM LIES a Ramireztoons LOOK ! TRUMP SAD SOMETHING DAOAN ... www.michaelpramirez com ",0
206.png,"Lori Hendry @ Lrihendry What 's the difference between progressivism , fascism , liberalism Marxism , Communism , Socialism Nazism , and the Democrat party ? Spelling 4:51 PM 07 Oct 16 119 RETWEETS 155 LIKES Patrick @ GrunaugenWolf A @ Lrihendry got nothing 1h ",0
207.png,ROSS PEROT HAD 8 % SUPPORT BUTGOT TO BE IN THE DEBATE GARY JOHNSON HAS 9 % BUT THATIS NONE OF MY BUSINESS irngflip.com ,0
208.png,"After the Bern subsides , get ready to ... Feel The Johnson ",0
209.png,DEMOCRAT SUPPORTSGUN CONTROL BRANDISHES AK-47 WITH THUMB ON TRIGGER ,1
210.png,Ernie checks if he mentioned Hillary Clinton and the Obama family in the second publishing of the Panama Papers . ,0
211.png,phase 2 Phase 1 Phase 3 Make Collect Ravenous America Great Supporters Again Donald J. Trump 's Fantastic Campaign Plan ,0
212.png,angel enriquez 5 days ago a Donald glover looks exactly like childish gambino wtf Reply 776 ,1
213.png,THE MAJORITY OF YOU ARE GOING TO BE REALLY DISAPPOINTED WHEN TRUMP IS GONE on Inngur ,0
214.png,Bernie or Be informed . Compare them on the issues that matter . Pepe `` I love the sad frog ! '' rares ,1
215.png,BENGHAZI CO ILLALLOWIT ! THE CLINTON FOUNDATION CD ILLALLOWIT ! VOTER TAMPERING CD ILLALLOWIT ! LYING TO THEAMERICAN PEOPLE CD ILLALLOWIT ! ,1
216.png,maGBa662B5Murphy -net www.shutterstock.co What if Bernie Sanders were a Communist ? ProiectMurphy ,1
217.png,"Share Wow Care . Listen , Hills , you 're going to go on and you 're gon na make lots of policy and I will never you 're gon na watch let go , Bern ! it grow . ",0
218.png,Obamacare Citizens forced to buy healthcare coverage that Drs and hospitals will not accept . This stupidity has been brought to you by the DEMOCRAT Party ,0
219.png,BEING A REPUBLICAN OR DEMOCRAT WASTING TIME AND ENERGY ,0
220.png,"K Notes October 31 , 2016 at 12:40 PM Dear Huma Psst . Just wanted to let you know l think climate change is fake . Also , women should be punished for abortions . Plus , Mexicans are rapists and criminals , and Muslims ( all of them ) should be treated like terrorists . Oh , and get this : I have n't paid taxes in years . Like , almost no taxes at all . Alright , got ta run , Tim Kaine wants to chat about how conversion therapy is good . And when we 're done , I 'm gon na grab him by the cock , which I 'm allowed to do because I 'm famous . You 're a 4 at best Hillary P. S. What day do l have to be in court for my child rape thing again ? ",0
221.png,"10:47 PM AT & T en.m.wikipedia.org ey playing for the United States in May 2013 Personal information Clinton That Man Mama Dempsey March 9 , 1983 ( age 31 ) 11 rth irth Nacogdoches , Texas , United States 1.85 m ( 6 ft 1 in ) 2 ] Forward , Attacking Midfielder osition Club information Seattle Sounders FC am Youth career Dallas Texans ",1
222.png,THE BEAUTY OF ME IS THAT I 'M VERY RICH . '' DONALD TRUMP bit.ly/stopthegop AMERICANS AGAINST THE REPUBLICAN PARTY ,1
223.png,AS WORTHLESS AS STATES AMMEEREEA 0 0 c U 8 12 THREE 0 0 ICU 8 12 MILARS A CLINTON PROMISE made on imgur ,1
