image_path,sentence,label
0.png,"I do n't vote Republican or Democrat . Choosing is a sin , so I always just write in the Lord 's name ! That 's Republican , we count those . ",0
1.png,"98 % 12:55 PM LTE K Daddy 02/26/2016 Fri FYI , I just caught a Car full of boys stealing the Bernie sign from our yard . chased them down , fussed at them and made them give me the sign back ! I respect your right to endorse your candidate ! 12:49 PM Holy crap ! Thank you ! Is it back in the ground ? Did you ask them what they were gon na do with it ? m curious if they wanted their own ! 12:52 PM No they do not support him , of course it is back in the ground . 12:52 PM ",0
2.png,HEY GIRL EVERYTIME SOMEONE DECIDESTO VOTE FOR BERNIE SANDERSISMILE ,0
3.png,Anonymous ( ID : FaNLvGay 09/30/16 ( Fri ) 00:23:22 No . 90944787 > be Hillary > be former secretary of state > be wife of former POTUS current POTUS Obango is shilling for her > all living former POTUS are on her side > MSM is shilling for her day and night > a super-villain billionaire is spending his fortune to get her into the oval office > her party did all sorts of crooked shit to get her the nomination an army of idiots are waging a war for her on the internet > even the FBI is setting their asses on fire to save her STILL CA N'T MAINTAIN A LEAD OVER THE ORANGE FACED IDIOT FROM THE APPRENTICE Hillary is probably the worst candidate in history . Why are people even considering her ? ,0
4.png,"Manny Loko Jimenez This offends me as a vegan transgender atheist German engineer who vapes organic decaffeinated compressed soy breast milk on the regular and a person Who does Indian naked crossfit yoga five times per week l 'm also a male feminist and identity myself as a Rastafarian Apache helicopter who serves only to one master my Chihuahua Which I . Helped Cross the border of Mexico plus l hate Donald Trump.My dog also walks me , if you find that weird you 're a arrogant ignorant homophobic globaphobic sexist Sun at 6:40 PM Like I 758 Reply ",0
5.png,actual scale ( simplified ) Bernie Hillar Trump commutists revisionist socdems liberals conserwtives fascists anarchists Socialists AMERICAN scale Bernie Hillary Trump NAZS GODLESS COMMIES ,0
6.png,"THE bARGAA T N 3 4 Oh hia Penisstore had U cooked the pastries 4 2nites partee ? ? ? yES SNOTragl i HEV COCKED IEK VEW ASCIENED ME how MANY pe Pro r CUMMING 2 da Party e ? U ( DUMN hora ) , ME , nURDIEONID , tHE SEM ITE , aIMLEz , Bernie Winters & ragingpoo So sefun people are comming So for each , da kwantity of pie LS about 22 Punchline** JAJAJAJA Eyes watering ",0
7.png,VOTE GREEN BERNIE ANGRY ! ,0
8.png,BERNIE WO N'T BE ABLE TO GET ANYTHING DONE WITHOUT CONGRESS AND TRUMP WILL TURN THIS COUNTRY INTO NAZI GERMANY ALL ON HISOWN ,1
9.png,Bernie or Hillary ? Be informed . Compare them on the issues that matter . Issue : Favorite Call of Duty ? CALL DUTY ,0
10.png,SANDERS N 2016 Bernie Sanders Communist Fl tem condition : New Quantity 1 Was US $ 19 89 You save : $ 9.94 ( 50 % off ) Price : US $ 9.95 6 watching Free shipping Shipping FREE Standard Shi ,0
11.png,"UT 14 hrs No way . Before Her Assassination , Berta Caceres Singled out Hillary Clinton for Backing Honduran Coup Former Secretary of State Hillary Clinton is facing a new round of questions about her handling of the 2009 coup in Honduras that ousted democratically elected . DEMOCRACY NOW ORG Like Comment a Share Not the first , and definitely not the last person that has been terminated by the Killary regime . The Clintons are a modern day global mafia Like Reply 1 hr ",1
12.png,BORREL CNN OCBS CLINTON BROADCASTING CLINTON NEWS NETWORK NETWORK aoc NBC ALL BEHIND CLINTON NOBODY BUT CLINTON ,1
13.png,"When Trump purchased and rebuilt Mar-A-Lago the Grand mansion and estate In Palm beach , Florida he got into a dispute with the city , who are well known for being strict on zoning regulations . Trump put up a 50 foot flag pole even though 30 foot is the maximum allowed . The city imposed a 1,000 dollar fine per day . While Trump and the city argued back and forth , finally when the fine had reached 120,000 dollars Trump proposed a solution . He would donate that amount to veterans organizations , would move the flag and pole to a different location in front of the mansion and would only use a 30 foot flag pole . The city agreed . So Trump brought in the company who does Golf course construction had them build a 20 foot high grassy hill and put a 30 foot flag pole on top of that ",0
14.png,"Donald J. Trump areal DonaldTrump 2/7/13 Obama can kill Americans at will with drones but waterboarding is not allowed-only in America ! t 1,258 829 M Russell Steinberg @ Russ Steinberg 2/7/13 @ real Donald Trump If you hate America so much you should run for President and fix things 918 t 1,424 Donald J. Trump arealDonald Trump 2/7/13 @ Russ Steinberg Be careful ! t 1,769 1,539 ",1
15.png,Hillary Clinton will endthe Republican war on women . Those women were ng Whores Did n't she marryA a serial rapist ? HILLARY 2016 Eileen Wellstone Elizabeth Gracen Juanita Broaddrick Regina Hopper Kahleen Wiley Sandra Janes Kathy Bradshav Cristy Zerche Paula Jones HIL Carolyn Motet ,1
16.png,Enter to wi n dinner with Donald Trump ,0
17.png,"Isaac NOT Issac Follow @ The FliestPlane When Donald Trump becomes president and you 're walking down the street and hear Aye boy where ya freedom papers ? RETWEETS LIKES 23,868 21,289 5:58 PM 15 Mar 2016 ",0
18.png,"Actual conversation at Hillary supporter : ARE YOU VOTING TODAY ? `` Yeah , for Bernie . '' `` Okay , good luck with that , see you in September . `` Sorry , I refuse to vote for someone who plans on making it harder for me to marry the woman l love . '' Uh *thumbs up from 5+ people around me and 24 others 7 Comments ",0
19.png,A FUTURE TO BELIEVE IN BERNIE SANDERS.COM ,0
20.png,WHO CARES WHAT TRUMP SANDIN 2005 Mike Green HE WAS DEMOCRAT BACK THEN SO IT 'S NOT HIS FAULT ,1
21.png,ITS SIMPLE BERNIE HILLARY TRUMP ,0
22.png,"All Unread I FROM Hillary Clinton Popula SUBJECT I need you right now , Jeffrey Nathan Fillion Tweeted : No , no , it 's not p Current Mailbox RECEIVED SIZE Sun 10/9/2016 4:08 P 34 KB Sun 10/9/2016 2:23 P 99 KB ",0
23.png,Donald Trump Pros : Not Hillary Cons : Donald Trump Hillary Clinton Pros : Not Trump Cons : Hillary ,0
24.png,How do I fix Americas immigration problem ? Can I call you back ? Bernie is on the other line asking me about economics . ,1
25.png,"wish political debates were run like American Idol , Just so I can hear Ryan Seacrest Say `` To show your support for Bernie Sanders , text Feel The Bern to 367567 '' `` To show your support for Donald Trump , text the N-word to 367567 '' lul seanhyatt sucks ",0
26.png,GB Tube You Search Donald Trump e LIKE and SHAREll IThis is a Live Broadcast from Golden St LIV ,1
27.png,Bernie is Red Free College Tuition WAKE ME UP INSIDE Goofy Edition ,0
28.png,"Here 's the man who threw tomatoes at Donald Trump last night . Andrew Alemao . # iacaucus icp-c.com/2051bQi Endy Ramirez Andrew you are officially a Mexican in the eyes of all my Mexicans you can do and act like we do . you want to come thru our cook outs ? come thru they get popping Beers Carne Asada , Girls dancing all that shit , when our mom 's or abuelas make tamales or posole you sir will be invited Mi casa su casa , You are no longer Andrew you are Andres welcome to our family fucker ",0
29.png,Amazing Myths of Why For Donald Tanked The Debate Vot A `` C KIND OF VIRAL ,1
30.png,EVERYONE IS CONCERNED ABOUT TRUMP GETTING THE NOMINATION AND ITMJUSTSITTING HERE VOTING FOR GARY JOHNSON ,0
31.png,"`` DonALD TRUMP IS A FAT ORANGE LOUDMOUTH AND HILLARy CLITony IS CROOKED , AND JET THE PALUns ARE 5TILL ARGUInG OVER THEm . EXACTLy HOLLI THE IMASTERS ... InTEnDED . AND HERE I Am , RISING ABOVE THE BULLSHIT . TOO INTELLIGENT AND TOO ALLAKE , TO BUSy MUSELF in THE SOUABBLinG OF THE 1 % 5 CHOSEn CANDIDATES , A DELIBERATE DISTRACTIOnA IT IS An ILLUSION . AND L HAVE mORE IMPORTANT MATTERS TO ATTEND TO ",1
32.png,Like Page 21 hrs NOW WHY WOULDANORGANDATION CREATEDBYDEMOCRATS THE GOP . BEGINS TO UNE Up BEHIND THE PRESUMPTIVE NOMINEE VOTE REPUBLICAN ? 2.9k reactions 85 Comments 1.2k Shares I Like Comment Share and 2.9k others Top comments Write a comment ,1
33.png,"Republican 1988 , Reform Party 1999 Democrat 2004 , Republican 2009 Independent 2011 , Populist 2016 , Americans Love/Hate him Traditional Marriage 3 , Divorced 2 , Anti-immigration , Marries an Immigrant Hates Muslims , Helps Rich Muslims Loves China , Stocks in China Buy His Books and Get Rich . NEXT PRESIDENT OF CHINA and USA MAKE TRUMP RICH AGAIN ",1
34.png,2 hrs THAT AwKWARD MoMENT wHEN ... I. BERNIE SANDERS ADMITs HE IS A DEMocRATIC SoCIALIST . 2 . NAZIS wERE DEMocRATIC SoCIALISTs 3 . AMERICA FOUGHT AN ENTIRE WORLD WAR To STOP THE ADvANCE oF DEMocRATIC SoCIALISTS . SINCERELY SANE AMERICANS Like Comment a Share and 9 others A Nazi is a member of the National Socialist German Workers ' Party . They are not Democratic Socialists . Like Reply 12 mins Write a comment ... ,0
35.png,"3 hrs Black nurse in Connecticut asked me if Trump was bringing back slavery in earnest . Chuck : No ma am . I know some real raaaacists but we do n't ever talk about bringing back slavery . That 's not on the agenda . Nurse : That 's good . What do y'all talk about ? Chuck : Mostly we do n't want your menfolk having raping our women , mugging us , or killing us . We also want you to stop having kids we got ta pay for Nurse : yeah we got to stop doing that . Well I liked Donald on the Apprentice . Ill vote for him . There are too many Puerto Ricans in this country . They the ones you got ta watch Why ca n't we have a conversation like this on race ? ",1
36.png,WHY THE FUCK DOES THE MEDIA IGNORE GARY JOHNSON BUT ONLY STARTS TALKING ABOUT HIM AFTER HE HAS A TINY MISUNDERSTANDING made on imgur ,1
37.png,BERN IS KING ,0
38.png,POLITICS Trump entertains idea of not serving as president if he wins election ,1
39.png,Bernard Bernie Sanders we will win in all the states in America and he will definitely win in Washington DCBernard B Sanders 2016 President Bernard Bernie Sanders 2017 to 2025 America The White House and the Oval Office . Bernie sanders way higher delicates votes and states way more ahead of Hillary Clinton Sanders 2016 no ary Clinton . Like Reply 7-3 hrs ,0
40.png,You whipped out that Mexican thing again . Mike Pence . GOP Candidate for VP of the United States ,1
41.png,"Photos : The Republican National Convention Melania Trump kisses her husband , Donald , after she spoke Monday on the first day of the Republican National Convention . `` If you want someone to fight for you and your country , I can assure you , he 's the guy , '' she said of her husband , the GOP 's presumptive nominee He will never , ever give up . And most importantly , he will never , ever let you down . '' 1 of 24 Hide Caption ",1
42.png,`` Bernie looks like the guy in disaster movies who knows what 's coming but no one listens to b/c he has bad hair & keeps dropping his papers ,0
43.png,"Bernie or Hillary Be informed . Compare them on the issues that matter . Sleep Issue : `` I 've been a support since the early 90 's . I 'm `` 6 Hours a Night ! '' also partial to High on Fire , and om . '' ",0
44.png,"Bernie Bernie Sanders e @ BernieSanders Let 's say it loud and clear : women control their bodies , not the government . arizonagunguy Let 's say it loud and clear gun owners control their guns , not the government diesel fumesniffer Everyone say it with me . Adults control their healthcare , not the government . your uncle dave Let 's say it loud and clear : Wage earners control their money . not the government . liberty bill Let 's say it loud and clear the market coordinates time with interest , not the government . redbloodedamerica Let 's say it oud and clear : private companies and consumers control the market , not the government ",1
45.png,"E Victims i of Communism You Gov M e m o r a I F o u n d a t i o n First-of its kind YouGov Poll Shows `` Bernie Sanders Bounce '' for Collectivism , Surprising Support for Socialism and Communism Among Younger Americans 45 % of 16-20 year olds would vote for a `` Socialist '' , 21 % for a `` Communist '' One-third of Millennials Believe George W. Bush Killed More People Than Stalin Vast Majority Unaware of Communism 's Death Toll More Millennials Prefer Words of Karl Marx over the Bible Bernie Sanders ' Philosophy Wins More Support Than Milton Friedman 's ",0
46.png,PUTS COUNTRY AHEAD OF PARTY DOES NOT ENDORSE TRUMP . DISTANCESHIMSELF FROM REPUBLICAN CONVENTION made on imgur ,1
47.png,Search Hillary not no better going to take your your freedom and bring in more refugees to destroy this country . Neither may not be good but I want to save my country . And not any one take it from us Muslim have no right to bring their laws here and say take God out of schools the ten commendments away so screw it we the people have the right to save America no more illegals no more refugees no more free tax for non Americans every body pays taxes and no more tax credits for non Americans . Muse come a citizen to work here . Or we all be walking the trail of tears again only worse 2 hours ago Like Reply ,0
48.png,"kle watching the dem debate HELL YEAH , BERNIE ! Why is Hillary avoiding the questions ? Stahp HILLARY Fucking stop . I SWEAR TO FUCKING GOD HILLARY ANSWER THE GOD DAMN QUESTION STOP AVOIDING THE TOPIC AND ACTUALLY HAVE A FUCKING DEBATE ALI ",1
49.png,THERE ARE MORE BOTH TRUMPAND THAN TWO CHOICES ! HILLARY SUCK ! THEY SUCK TOO ! ,0
50.png,what happens if Jill Stein does n't win the elections ? '' Plan B . Plan b ? me ,0
51.png,WHY THE FUCK DOES IRITHE DONALD HAVE BETTER NEWS COVERAGE THAN IRINEWS made on imgur ,1
52.png,Journalists HATE Him ! Politician 's discovery revealed the secret to creating a political revolution with just one vote of yours Watch this shocking video and discover how you can topple the establishment with one simple democratic act ... One single vote No radical ideas required . absolutely guaranteed that you will Feel the Bern ! Click to Watch Video Now ,0
53.png,Hillary Clinton Ben Ghazi 2016 ,0
54.png,EITHER HILLARY IS INNOCENT OR YOU CA N'T TRUST A REPUBLICAN TO HEAD UP THE FBI GOP SUPPORTERS MIGHT WANT TO SIT THIS ONE OUT on inngur ,0
55.png,"Max @ mdlabick BERNIE SANDERS RALLY 2016-02-24 , 10:10 AM ",1
56.png,Dirty Donald Crooked Clinton Which Democrat Will America Choose ,1
57.png,when u know Trump bout to be president & u got ta tell ur friends goodbye the worldpolice ,1
58.png,MAMAS Who am I supposed to vote for ? Am l supposed to vote for the Democrat who 's going to blast me in the or the Republican who 's blasting my ass ? ,0
59.png,TIME MACHINE PICOF THE WEEK . AUGUST 2066 A BERNIE OR BUST made on imgur ,0
60.png,"Bernie or Hillan Be informed . Compare them on the issues that matter . Issue : WHAT IS LOVE ? Do n't Hurt Me , Got to do Do n't Hurt Me , it ? No More with ",0
61.png,2:28 PM THIS IS A WALL INSIDE A NAZI GAS CHAMBER dwebs WHEN A DEMOCRAT MENTIONS GUN CONTROL REMEMBER THIS PICTURE ,1
62.png,RISE TOGETHER What are rail tr BERNIE SANDERS FOR PRESIDENT FOR THE PEOPLE ,0
63.png,"Donald Trump talks like real men talk . Real men talk dirty Women expect it . Here in Alaska we do , anyway We like our men tough . Sweet talk is for weak- wristed liberals . Sarah Palin , 10/11/16 ",0
64.png,"94 % , 11:12 AM www.cnn.com/2016/05/19/politics/donald trump-egyptair-terre E BREAKING NEWS Hillary Clinton says EgyptAir Flight 804 highlights threat from organized terror groups . Watch her live now . politics CNN Donald Trump does n't wait for investigators to call missing EgyptAir flight act of terror ",0
65.png,NOOING THE GOP COMING UP : FLORIDA ZIKA FIGHT WHAT TRUMP SAW PENCE EXCLUSIVE NTERVIEW 1 YEAR-OLD 'S HARD QUESTION WOOING THE GOP LIVE CLINTON REACHES OUT TO WARY REPUBLICANS MSNBC YEARS L. NEARLY DOUBLING THE FIVE-POINT ADVANTAGE SHE HELD OVER HER 8:25AM MT ,0
66.png,V M F silent WITH DS Donald Trump has broadened his appeal ,0
67.png,an 23 Bae : Come Over Bernie : ca n't l 'm running for President Bae : I have student loans Bernie 46K ,0
68.png,IF YOU HATE TRUMP AND CLINTON CONSIDER VOTING FOR GARY JOHNSON ,1
69.png,le acid . FEEL THE BERN Do you support Sanders 2016 sir ? FEEL THE BERN FEEL THE AHHHHHHHHHHHHH ! IT BERNS BERN ,1
70.png,Donald Trump could do no right . Hillary could do no wrong So between them both you see they fooled the American throng . ,0
71.png,"November 2016 : `` and the president of the United States is , Mr. Donald Trump '' ",0
72.png,I 'M SO EVIL EVEN SATAN IS VOTING REPUBLICAN ,1
73.png,I DO N'T LIKE THE LOOKS OF THIS TRUMP PENCE A A ,1
74.png,"It 's illegal to intimidate voters at a polling place , so even if a black person wanted to vote Republican today , it 's kind of illegal . @ antoniocomedy ",0
75.png,BILLIONAIRES CA N'T BUY BERNIE BERN IES ANDERS.COM NOW THIS IS AWKWARD ,0
76.png,"IS BERNIE SANDERS ENDORSING THE ESTABLISHMENT HE CAMPAIGNED AGAINST OUT OF TOUCH WITH WHAT HIS VOTING BASE WANTEDP NO , IT 'S THE VOTERS WHO THOUGHT THERE H COULD ACTUALLY BE TRUE POLITICAL CHANGE IN AMERICA WHO ARE OUT OF TOUCH . made on imgur ",1
77.png,NOW YOURE READY TO VOTE FOR HILLARY ,1
78.png,Bernie or Hillary ? Be informed . Compare them on the issues that matter . Issue : Losing Bets Pays you `` We never shook up front hands bro '' ,0
79.png,How to get to reddit frontpage XVZneWS.COm Bernie got up at 700am today and brushed his teeth 1 . Copy link 2 . Post link on r/politics 3 . Frontpage ,0
80.png,"Why are so many Millennials voting for Bernie Sanders ? Simple , they grew up learning some valuable lessons The Media is not always honest and often manipulates the facts in order to push the narrative they want people to believe . Unchecked power and privilege often oppresses and marginalizes groups based on differences , thus inducing inequality and hate . Evil comes in all forms . Even the most innocent looking can be a power-hungry , greedy , vindictive , corrupt , narcissistic , liar . It is true bravery to stand against evil and corruption and for what is Rightin the face of extreme opposition , People can be victorious when they STANDUNITED ! # Not Meus And ultimately , Millennials learned ally is a wise old man who cares BERNIE SANDERS FOR PRESIDENT in 2016 `` Age is foolish and forgetful when it @ PoliticoPotter underestimates youth . '' -Albus Dumbledore ",0
81.png,"TRIBUNE I MeT WITH BILL CLINTON , BUT We ONLY TALKED ABOUT OUR GRANDCHILDReN . GeNeRAL LORETTA LYNCH THEY DO N'T SO , HOW ARe WANT To HAve TO ViSiT THe GRANDKiDSS THeiR GRANDMA In PRISON ! ! Cagle com ",0
82.png,Having too choose between Hillary Clinton and Donald Trump like . guess Ill d ,0
83.png,"Give a man a fish , and he eats for a day . Give a man a welfare check , a free cellphone , food stamps section 8 housing , a six-pack of beer , a crack pipe , and some Air Jordon 's , and he 'll vote Democrat the rest of his life ",1
84.png,Pre @ R . Donald J. Trump pro Trumpinsulter every or DAT BOI did an absolutely horrible job . DAT BOI should be ashamed of himself 6:41 PM 4 MAY 2016 Share this for real AGAIN ! OW ,0
85.png,A FUTURE TO BELIE BERN IES ANDERS COM Crowd mistakes small bird for 800 delegates ,0
86.png,"23 hrs To all my friends on FB , just a short note to you on our pus headed `` president '' This character who l refer to as zero ( 0 ) should have been taken out by our military and shot as an enemy agent in his first term Instead he still remains in office doing every thing he can to gut the America we all know and love Now comes Donald J Trump to put an end to the corruption in government The so called elite , who are nothing but common dog turds from your front lawn are shaking in their boots because there is a new Sheriff coming to town , and the end to their corruption of the American people ( YOU ) is at hand I can not believe that a common murder is even allowed to run ( killery clinton ) OR that a commie like bernie is a also allowed to also run Come on America put your big boy pants on -- this election you have a choice -- GET YOUR ASS OUT AND VOTE Thank you ni Like Comment Share ",1
87.png,"Hillary Clinton a HillaryClinton @ realDonaldTrump thinks democrats care about his opinion , how does it feel putting your stuff where it does n't belong ? 2210 1272 RETVEETS FAVORITES Donald J. Trump areal Donald Trump Hillary Clinton Ask Bill . 3322 5880 REE TWEETS FAVORITES ifunny.CO ",0
88.png,I LOVE GARY JOHNSON ! DO YOU REALLY LOVE GARY JOHNSON OR ARE YOU JUST LOOKING AT CANDIDATES AND SAYING YOU LOVE THEMP made on imgur ,1
89.png,us on facebook VOTE FOR A DEMOCRAT AGAIN . NO MATTER WHO THEY ARE . I DO N'T CARE IF GOD BECOMES A DEMOCRAT THESE DEMOCRATS ARE GANGSTERISM . THIS IS CRAZY '' Do you agree ? Comment YES or NO ,1
90.png,"e in talifrnia Find your polling place Check if you 're registered to vote G Republican primary 6 mins ago Donald Trump won NJ NM , and SD G Democratic primary 6 mins ago Hillary Clinton won the New Jersey primary More results Los Angeles Angels of Anaheim ",0
91.png,S OUT The mistake that really lost this election for Bernie Sanders was not marrying Bill Clinton when he had the chance . @ Ben Longcomedy ,0
92.png,"CIRQUE DU SO LAME Paul Ryan , Donald Trump , Mike Pence , and Reince Priebus the act known to all as `` The Aristocrats arrives today in Cleveland for performances on July 18-21 [ Parental Advisory : Thematic content , coarse/crude language , disturbing images ] ",1
93.png,"at This is horrifying ! Share this to spread the word . A vote for Hillary is a vote to kill babies ! You just heard Hillary Clinton explicitly defend , and say point blank that late term partial birth abortions are ok and that she will appoint Supreme Court justices to ensure that they remain legal . That means that up until the babies due date , the baby is half delivered , kicking and screaming , and its spine is cut or brain punctured . If you 're ok with that , you are dead inside . ILLUSTRATION OF PARTIAL-BIRTH ABORTION Like Share Comment 180 ",1
94.png,"Guy Hussein 2 hrs 13 Attention all communist scum . At 1:36 AM Pinochet 's AnCap Militia infiltrated Paul Krugman 's office and kidnapped his favorite My Little Pony plushy , the one he sleeps with at night . We will execute Dashy at exactly 12:00 Midnight EST unless our demands are met . Our demands : 1 ) Make the NAP part of the US Constitution 2 ) End the Federal Reserve 3 ) Make the official currency a gold backed version of Bitcoin , PinoCoin . 4 ) Revoke all educational awards and diplomas from all communist scum , they do n't deserve them . 5 ) Deport Bernie Sanders . 6 ) Segregate all leftists with Jim Crowe themed laws . 7 ) Publicly admit Israel is totally gay ",1
95.png,BRACE YOURSELF THE REPUBLICAN CONDEMNATIONS OF TRUMP ARE COMING . made on imgur ,1
96.png,"A HEAL Bill Clinton was the first nigga president , not Obama . Haha you do n't got to be black to be a nigga you can be any race . If you do nigga shit than you 're a nigga and my nigga freaky Bill got his dick sucked by a cute fat bitch while his wife was down the hall in their bed room . Now if that ai n't sum nigga shit than do n't know what is and the nigga smoke weed too . ",1
97.png,"They both sound like idiots . What they do n't realize is Democrat , Republican Only an illusion on making the people think they can choose their leaders , and keeping the people separated as 1 . Elections are not real , only an illusion . 11 hours ago ",0
98.png,"IF YOU RE A BERNIE SUPPORTER WHO WANTS TO VOTE FOR TRUMP , YOU HAVE FOUR OPTIONS : DONT VOTE 2 . VOTE FOR ANY THIRD PARTY CANDIDATE 3- VOTE FOR TRUMP HIMSELF 4 . STAB YOURSELF IN THE EYEBALL . HAPPY HUNTING ! ",1
99.png,Bernie or Hillary ? Issue : Chicken wings Wingstop is the spot . Some lemon pepper wings with some BWW is my chicken wing spot ! mf mango habanero sauce . Some Those BBQ wings sure are spicy ! original hots on the side so l can really feel that bern ,0
100.png,"rump economic plan would r 3.5 million vols , scares me of anothe rum p Prrs alt ncy . 3 . Write down the Donald Trump quote that most impressed you Why ? 4 , Write down the Donald Trump quote that most alarmed you Why ? rump claimed he has been ouolted for ",0
101.png,"SURE YOU CAN HEAR WHAT HILLARY CLINTON HAS TO SAY THAT LL BE S10,000 VOU DONT HAVE S10,000 ? OHGEEL THAT 'S TOO BAD GUESS YOULL HAVE TO HEAR THE OTHER SPEECHn ",1
102.png,WHAT IFI TOLD YOU THAT MORE THAN 40 % OF CONGRESS ARE HILLARY SUPERDELEGATES SOINCREASED SUPPORT FOR GARY JOHNSON WILL RESULTINAHILLARY PRESIDENCY NO MATTER WHAT ,1
103.png,UNITE THE PARTY It 's time for Ted Cruz to drop out NO HILLARY IN NOV LSE ,0
104.png,"FREE ! ? think you mean STOLEN from the taxpayers ! There 's no such thing as FREE breadsticks you fucking socialist , learn economics ! sir this is an Olive Garden FUCK bernie s Free with Archyse ",1
105.png,SUBTOGETIRIDOFTHE SPAM INSTEAD THEY JUST DECIDE TO COMPLAIN ABOUTITBECAUSE THEY DONTLIKE TRUMP BUT THATSNONE OF MY BUSINESS imgflip-com ,0
106.png,The Washington Post ) DEBATE . DEMOCRATA DEBATE DEMOCRAT ,0
107.png,Rosita and the shop assistant look in amazement as Elmo masturbates over the newspapers front page story about Donald Trump winning the presidential election . ,0
